15:43:03.556152 IP (tos 0x0, ttl 128, id 8628, offset 0, flags [DF], proto TCP (6), length 40)
    192.168.1.115.60703 > 192.168.1.116.80: Flags [F.], cksum 0x523f (correct), seq 2575784526, ack 2106357389, win 1021, length 0
15:43:03.556199 IP (tos 0x0, ttl 64, id 0, offset 0, flags [DF], proto TCP (6), length 40)
    192.168.1.116.80 > 192.168.1.115.60703: Flags [.], cksum 0x554f (correct), seq 1, ack 1, win 237, length 0
15:43:03.556437 IP (tos 0x0, ttl 128, id 8629, offset 0, flags [DF], proto TCP (6), length 52)
    192.168.1.115.60710 > 192.168.1.116.80: Flags [S], cksum 0x8180 (correct), seq 1629428418, win 65535, options [mss 1460,nop,wscale 8,nop,nop,sackOK], length 0
15:43:03.556467 IP (tos 0x0, ttl 64, id 0, offset 0, flags [DF], proto TCP (6), length 52)
    192.168.1.116.80 > 192.168.1.115.60710: Flags [S.], cksum 0x845e (incorrect -> 0x7117), seq 3700408760, ack 1629428419, win 29200, options [mss 1460,nop,nop,sackOK,nop,wscale 7], length 0
15:43:03.556571 IP (tos 0x0, ttl 128, id 8630, offset 0, flags [DF], proto TCP (6), length 40)
    192.168.1.115.60710 > 192.168.1.116.80: Flags [.], cksum 0x1ffa (correct), seq 1, ack 1, win 1024, length 0
15:43:03.556697 IP (tos 0x0, ttl 128, id 8631, offset 0, flags [DF], proto TCP (6), length 446)
    192.168.1.115.60710 > 192.168.1.116.80: Flags [P.], cksum 0x2942 (correct), seq 1:407, ack 1, win 1024, length 406: HTTP, length: 406
	GET /dokuwiki/doku.php?id=wiki:welcome HTTP/1.1
	User-Agent: Mozilla/5.0 (Windows NT 10.0; Win64; x64) AppleWebKit/537.36 (KHTML, like Gecko) Chrome/64.0.3282.140 Safari/537.36 Edge/17.17134
	Accept-Language: en-AU
	Accept: text/html,application/xhtml+xml,application/xml;q=0.9,*/*;q=0.8
	Upgrade-Insecure-Requests: 1
	Accept-Encoding: gzip, deflate
	Host: 192.168.1.116
	DNT: 1
	Connection: Keep-Alive
	
15:43:03.556733 IP (tos 0x0, ttl 64, id 13682, offset 0, flags [DF], proto TCP (6), length 40)
    192.168.1.116.80 > 192.168.1.115.60710: Flags [.], cksum 0x8452 (incorrect -> 0x2177), seq 1, ack 407, win 237, length 0
15:43:03.557153 IP (tos 0x0, ttl 64, id 13683, offset 0, flags [DF], proto TCP (6), length 730)
    192.168.1.116.80 > 192.168.1.115.60710: Flags [P.], cksum 0x8704 (incorrect -> 0x17e3), seq 1:691, ack 407, win 237, length 690: HTTP, length: 690
	HTTP/1.1 301 Moved Permanently
	Date: Wed, 12 Jun 2019 06:13:03 GMT
	Server: Apache/2.4.29 (Ubuntu)
	X-Frame-Options: DENY
	X-Content-Type-Options: nosniff
	Location: https://192.168.1.116/dokuwiki/doku.php?id=wiki:welcome
	Content-Length: 342
	Keep-Alive: timeout=5, max=100
	Connection: Keep-Alive
	Content-Type: text/html; charset=iso-8859-1
	
	<!DOCTYPE HTML PUBLIC "-//IETF//DTD HTML 2.0//EN">
	<html><head>
	<title>301 Moved Permanently</title>
	</head><body>
	<h1>Moved Permanently</h1>
	<p>The document has moved <a href="https://192.168.1.116/dokuwiki/doku.php?id=wiki:welcome">here</a>.</p>
	<hr>
	<address>Apache/2.4.29 (Ubuntu) Server at 192.168.1.116 Port 80</address>
	</body></html>
15:43:03.557286 IP (tos 0x0, ttl 128, id 8632, offset 0, flags [DF], proto TCP (6), length 40)
    192.168.1.115.60710 > 192.168.1.116.80: Flags [.], cksum 0x1bb5 (correct), seq 407, ack 691, win 1021, length 0
15:43:03.561934 IP (tos 0x0, ttl 128, id 8633, offset 0, flags [DF], proto TCP (6), length 52)
    192.168.1.115.60711 > 192.168.1.116.443: Flags [S], cksum 0x5d24 (correct), seq 671708872, win 65535, options [mss 1460,nop,wscale 8,nop,nop,sackOK], length 0
15:43:03.561987 IP (tos 0x0, ttl 64, id 0, offset 0, flags [DF], proto TCP (6), length 52)
    192.168.1.116.443 > 192.168.1.115.60711: Flags [S.], cksum 0x845e (incorrect -> 0xe998), seq 1055769213, ack 671708873, win 29200, options [mss 1460,nop,nop,sackOK,nop,wscale 7], length 0
15:43:03.562141 IP (tos 0x0, ttl 128, id 8634, offset 0, flags [DF], proto TCP (6), length 40)
    192.168.1.115.60711 > 192.168.1.116.443: Flags [.], cksum 0x987b (correct), seq 1, ack 1, win 1024, length 0
15:43:03.562453 IP (tos 0x0, ttl 128, id 8635, offset 0, flags [DF], proto TCP (6), length 210)
    192.168.1.115.60711 > 192.168.1.116.443: Flags [P.], cksum 0x19fd (correct), seq 1:171, ack 1, win 1024, length 170
15:43:03.562491 IP (tos 0x0, ttl 64, id 14003, offset 0, flags [DF], proto TCP (6), length 40)
    192.168.1.116.443 > 192.168.1.115.60711: Flags [.], cksum 0x8452 (incorrect -> 0x9ae4), seq 1, ack 171, win 237, length 0
15:43:03.566508 IP (tos 0x0, ttl 64, id 14004, offset 0, flags [DF], proto TCP (6), length 1488)
    192.168.1.116.443 > 192.168.1.115.60711: Flags [P.], cksum 0x89fa (incorrect -> 0x541b), seq 1:1449, ack 171, win 237, length 1448
15:43:03.566808 IP (tos 0x0, ttl 128, id 8636, offset 0, flags [DF], proto TCP (6), length 40)
    192.168.1.115.60711 > 192.168.1.116.443: Flags [.], cksum 0x922f (correct), seq 171, ack 1449, win 1018, length 0
15:43:03.569319 IP (tos 0x0, ttl 128, id 8637, offset 0, flags [DF], proto TCP (6), length 40)
    192.168.1.115.60711 > 192.168.1.116.443: Flags [F.], cksum 0x922e (correct), seq 171, ack 1449, win 1018, length 0
15:43:03.569569 IP (tos 0x0, ttl 64, id 14005, offset 0, flags [DF], proto TCP (6), length 40)
    192.168.1.116.443 > 192.168.1.115.60711: Flags [F.], cksum 0x8452 (incorrect -> 0x953a), seq 1449, ack 172, win 237, length 0
15:43:03.569719 IP (tos 0x0, ttl 128, id 8638, offset 0, flags [DF], proto TCP (6), length 40)
    192.168.1.115.60711 > 192.168.1.116.443: Flags [.], cksum 0x922d (correct), seq 172, ack 1450, win 1018, length 0
15:43:03.820778 IP (tos 0x0, ttl 255, id 52918, offset 0, flags [DF], proto UDP (17), length 220)
    192.168.1.116.5353 > 224.0.0.251.5353: [bad udp cksum 0xa3f1 -> 0x9944!] 0 [1a] [8q] PTR (QM)? _webdavs._tcp.local. PTR (QM)? _ftp._tcp.local. PTR (QM)? _webdav._tcp.local. PTR (QM)? _nfs._tcp.local. PTR (QM)? _smb._tcp.local. PTR (QM)? _afpovertcp._tcp.local. PTR (QM)? _sftp-ssh._tcp.local. PTR (QM)? _ipps._tcp.local. _ipps._tcp.local. PTR EPSON XP-432 435 Series @ xuongM-bM-^@M-^Ys MacBook Pro._ipps._tcp.local. (192)
15:43:05.508424 IP (tos 0x0, ttl 128, id 8639, offset 0, flags [DF], proto TCP (6), length 52)
    192.168.1.115.60712 > 192.168.1.116.443: Flags [S], cksum 0x4812 (correct), seq 1476746205, win 65535, options [mss 1460,nop,wscale 8,nop,nop,sackOK], length 0
15:43:05.508483 IP (tos 0x0, ttl 64, id 0, offset 0, flags [DF], proto TCP (6), length 52)
    192.168.1.116.443 > 192.168.1.115.60712: Flags [S.], cksum 0x845e (incorrect -> 0x43fc), seq 1808934435, ack 1476746206, win 29200, options [mss 1460,nop,nop,sackOK,nop,wscale 7], length 0
15:43:05.508651 IP (tos 0x0, ttl 128, id 8640, offset 0, flags [DF], proto TCP (6), length 40)
    192.168.1.115.60712 > 192.168.1.116.443: Flags [.], cksum 0xf2de (correct), seq 1, ack 1, win 1024, length 0
15:43:05.508922 IP (tos 0x0, ttl 128, id 8641, offset 0, flags [DF], proto TCP (6), length 210)
    192.168.1.115.60712 > 192.168.1.116.443: Flags [P.], cksum 0xe598 (correct), seq 1:171, ack 1, win 1024, length 170
15:43:05.508956 IP (tos 0x0, ttl 64, id 53399, offset 0, flags [DF], proto TCP (6), length 40)
    192.168.1.116.443 > 192.168.1.115.60712: Flags [.], cksum 0x8452 (incorrect -> 0xf547), seq 1, ack 171, win 237, length 0
15:43:05.514546 IP (tos 0x0, ttl 64, id 53400, offset 0, flags [DF], proto TCP (6), length 1488)
    192.168.1.116.443 > 192.168.1.115.60712: Flags [P.], cksum 0x89fa (incorrect -> 0xee36), seq 1:1449, ack 171, win 237, length 1448
15:43:05.514777 IP (tos 0x0, ttl 128, id 8642, offset 0, flags [DF], proto TCP (6), length 40)
    192.168.1.115.60712 > 192.168.1.116.443: Flags [.], cksum 0xec92 (correct), seq 171, ack 1449, win 1018, length 0
15:43:05.517263 IP (tos 0x0, ttl 128, id 8643, offset 0, flags [DF], proto TCP (6), length 40)
    192.168.1.115.60712 > 192.168.1.116.443: Flags [F.], cksum 0xec91 (correct), seq 171, ack 1449, win 1018, length 0
15:43:05.517442 IP (tos 0x0, ttl 64, id 53401, offset 0, flags [DF], proto TCP (6), length 40)
    192.168.1.116.443 > 192.168.1.115.60712: Flags [F.], cksum 0x8452 (incorrect -> 0xef9d), seq 1449, ack 172, win 237, length 0
15:43:05.517584 IP (tos 0x0, ttl 128, id 8644, offset 0, flags [DF], proto TCP (6), length 40)
    192.168.1.115.60712 > 192.168.1.116.443: Flags [.], cksum 0xec90 (correct), seq 172, ack 1450, win 1018, length 0
15:43:05.519169 IP (tos 0x0, ttl 128, id 8645, offset 0, flags [DF], proto TCP (6), length 52)
    192.168.1.115.60713 > 192.168.1.116.443: Flags [S], cksum 0xc4c4 (correct), seq 3226236642, win 65535, options [mss 1460,nop,wscale 8,nop,nop,sackOK], length 0
15:43:05.519204 IP (tos 0x0, ttl 64, id 0, offset 0, flags [DF], proto TCP (6), length 52)
    192.168.1.116.443 > 192.168.1.115.60713: Flags [S.], cksum 0x845e (incorrect -> 0x1e13), seq 1354621907, ack 3226236643, win 29200, options [mss 1460,nop,nop,sackOK,nop,wscale 7], length 0
15:43:05.519308 IP (tos 0x0, ttl 128, id 8646, offset 0, flags [DF], proto TCP (6), length 40)
    192.168.1.115.60713 > 192.168.1.116.443: Flags [.], cksum 0xccf5 (correct), seq 1, ack 1, win 1024, length 0
15:43:05.519651 IP (tos 0x0, ttl 128, id 8647, offset 0, flags [DF], proto TCP (6), length 210)
    192.168.1.115.60713 > 192.168.1.116.443: Flags [P.], cksum 0x14e8 (correct), seq 1:171, ack 1, win 1024, length 170
15:43:05.519675 IP (tos 0x0, ttl 64, id 5474, offset 0, flags [DF], proto TCP (6), length 40)
    192.168.1.116.443 > 192.168.1.115.60713: Flags [.], cksum 0x8452 (incorrect -> 0xcf5e), seq 1, ack 171, win 237, length 0
15:43:05.524099 IP (tos 0x0, ttl 64, id 5475, offset 0, flags [DF], proto TCP (6), length 1488)
    192.168.1.116.443 > 192.168.1.115.60713: Flags [P.], cksum 0x89fa (incorrect -> 0x0529), seq 1:1449, ack 171, win 237, length 1448
15:43:05.524233 IP (tos 0x0, ttl 128, id 8648, offset 0, flags [DF], proto TCP (6), length 40)
    192.168.1.115.60713 > 192.168.1.116.443: Flags [.], cksum 0xc6a9 (correct), seq 171, ack 1449, win 1018, length 0
15:43:05.526448 IP (tos 0x0, ttl 128, id 8649, offset 0, flags [DF], proto TCP (6), length 133)
    192.168.1.115.60713 > 192.168.1.116.443: Flags [P.], cksum 0xee8e (correct), seq 171:264, ack 1449, win 1018, length 93
15:43:05.526978 IP (tos 0x0, ttl 64, id 5476, offset 0, flags [DF], proto TCP (6), length 91)
    192.168.1.116.443 > 192.168.1.115.60713: Flags [P.], cksum 0x8485 (incorrect -> 0xe0cc), seq 1449:1500, ack 264, win 237, length 51
15:43:05.527101 IP (tos 0x0, ttl 128, id 8650, offset 0, flags [DF], proto TCP (6), length 40)
    192.168.1.115.60713 > 192.168.1.116.443: Flags [.], cksum 0xc613 (correct), seq 264, ack 1500, win 1024, length 0
15:43:05.527410 IP (tos 0x0, ttl 128, id 8651, offset 0, flags [DF], proto TCP (6), length 479)
    192.168.1.115.60713 > 192.168.1.116.443: Flags [P.], cksum 0x956c (correct), seq 264:703, ack 1500, win 1024, length 439
15:43:05.569241 IP (tos 0x0, ttl 64, id 5477, offset 0, flags [DF], proto TCP (6), length 40)
    192.168.1.116.443 > 192.168.1.115.60713: Flags [.], cksum 0x8452 (incorrect -> 0xc767), seq 1500, ack 703, win 245, length 0
15:43:05.726289 IP (tos 0x0, ttl 64, id 5478, offset 0, flags [DF], proto TCP (6), length 2858)
    192.168.1.116.443 > 192.168.1.115.60713: Flags [P.], cksum 0x8f54 (incorrect -> 0x8e0f), seq 1500:4318, ack 703, win 245, length 2818
15:43:05.726587 IP (tos 0x0, ttl 128, id 8652, offset 0, flags [DF], proto TCP (6), length 40)
    192.168.1.115.60713 > 192.168.1.116.443: Flags [.], cksum 0xbea8 (correct), seq 703, ack 2960, win 1024, length 0
15:43:05.726633 IP (tos 0x0, ttl 128, id 8653, offset 0, flags [DF], proto TCP (6), length 40)
    192.168.1.115.60713 > 192.168.1.116.443: Flags [.], cksum 0xb960 (correct), seq 703, ack 4318, win 1018, length 0
15:43:05.728226 IP (tos 0x0, ttl 64, id 5480, offset 0, flags [DF], proto TCP (6), length 1634)
    192.168.1.116.443 > 192.168.1.115.60713: Flags [P.], cksum 0x8a8c (incorrect -> 0x7605), seq 4318:5912, ack 703, win 245, length 1594
15:43:05.728381 IP (tos 0x0, ttl 128, id 8654, offset 0, flags [DF], proto TCP (6), length 40)
    192.168.1.115.60713 > 192.168.1.116.443: Flags [.], cksum 0xb3a6 (correct), seq 703, ack 5778, win 1024, length 0
15:43:05.728389 IP (tos 0x0, ttl 128, id 8655, offset 0, flags [DF], proto TCP (6), length 40)
    192.168.1.115.60713 > 192.168.1.116.443: Flags [.], cksum 0xb321 (correct), seq 703, ack 5912, win 1023, length 0
15:43:05.729901 IP (tos 0x0, ttl 128, id 8656, offset 0, flags [DF], proto TCP (6), length 52)
    192.168.1.115.60714 > 192.168.1.116.443: Flags [S], cksum 0x7ecc (correct), seq 498098038, win 65535, options [mss 1460,nop,wscale 8,nop,nop,sackOK], length 0
15:43:05.729955 IP (tos 0x0, ttl 64, id 0, offset 0, flags [DF], proto TCP (6), length 52)
    192.168.1.116.443 > 192.168.1.115.60714: Flags [S.], cksum 0x845e (incorrect -> 0x6a45), seq 3697460739, ack 498098039, win 29200, options [mss 1460,nop,nop,sackOK,nop,wscale 7], length 0
15:43:05.730124 IP (tos 0x0, ttl 128, id 8657, offset 0, flags [DF], proto TCP (6), length 52)
    192.168.1.115.60715 > 192.168.1.116.443: Flags [S], cksum 0x038d (correct), seq 4200594948, win 65535, options [mss 1460,nop,wscale 8,nop,nop,sackOK], length 0
15:43:05.730146 IP (tos 0x0, ttl 64, id 0, offset 0, flags [DF], proto TCP (6), length 52)
    192.168.1.116.443 > 192.168.1.115.60715: Flags [S.], cksum 0x845e (incorrect -> 0xb2a9), seq 280612361, ack 4200594949, win 29200, options [mss 1460,nop,nop,sackOK,nop,wscale 7], length 0
15:43:05.730168 IP (tos 0x0, ttl 128, id 8658, offset 0, flags [DF], proto TCP (6), length 40)
    192.168.1.115.60714 > 192.168.1.116.443: Flags [.], cksum 0x1928 (correct), seq 1, ack 1, win 1024, length 0
15:43:05.730287 IP (tos 0x0, ttl 128, id 8659, offset 0, flags [DF], proto TCP (6), length 40)
    192.168.1.115.60715 > 192.168.1.116.443: Flags [.], cksum 0x618c (correct), seq 1, ack 1, win 1024, length 0
15:43:05.730296 IP (tos 0x0, ttl 128, id 8660, offset 0, flags [DF], proto TCP (6), length 52)
    192.168.1.115.60716 > 192.168.1.116.443: Flags [S], cksum 0xa149 (correct), seq 1906960637, win 65535, options [mss 1460,nop,wscale 8,nop,nop,sackOK], length 0
15:43:05.730316 IP (tos 0x0, ttl 64, id 0, offset 0, flags [DF], proto TCP (6), length 52)
    192.168.1.116.443 > 192.168.1.115.60716: Flags [S.], cksum 0x845e (incorrect -> 0x07e1), seq 1874048916, ack 1906960638, win 29200, options [mss 1460,nop,nop,sackOK,nop,wscale 7], length 0
15:43:05.730340 IP (tos 0x0, ttl 128, id 8661, offset 0, flags [DF], proto TCP (6), length 242)
    192.168.1.115.60714 > 192.168.1.116.443: Flags [P.], cksum 0xd4a9 (correct), seq 1:203, ack 1, win 1024, length 202
15:43:05.730372 IP (tos 0x0, ttl 64, id 12527, offset 0, flags [DF], proto TCP (6), length 40)
    192.168.1.116.443 > 192.168.1.115.60714: Flags [.], cksum 0x8452 (incorrect -> 0x1b71), seq 1, ack 203, win 237, length 0
15:43:05.730406 IP (tos 0x0, ttl 128, id 8662, offset 0, flags [DF], proto TCP (6), length 52)
    192.168.1.115.60717 > 192.168.1.116.443: Flags [S], cksum 0x2999 (correct), seq 236635196, win 65535, options [mss 1460,nop,wscale 8,nop,nop,sackOK], length 0
15:43:05.730425 IP (tos 0x0, ttl 64, id 0, offset 0, flags [DF], proto TCP (6), length 52)
    192.168.1.116.443 > 192.168.1.115.60717: Flags [S.], cksum 0x845e (incorrect -> 0xedfc), seq 4084127244, ack 236635197, win 29200, options [mss 1460,nop,nop,sackOK,nop,wscale 7], length 0
15:43:05.730447 IP (tos 0x0, ttl 128, id 8663, offset 0, flags [DF], proto TCP (6), length 40)
    192.168.1.115.60716 > 192.168.1.116.443: Flags [.], cksum 0xb6c3 (correct), seq 1, ack 1, win 1024, length 0
15:43:05.730455 IP (tos 0x0, ttl 128, id 8664, offset 0, flags [DF], proto TCP (6), length 242)
    192.168.1.115.60715 > 192.168.1.116.443: Flags [P.], cksum 0xb9f0 (correct), seq 1:203, ack 1, win 1024, length 202
15:43:05.730492 IP (tos 0x0, ttl 64, id 14561, offset 0, flags [DF], proto TCP (6), length 40)
    192.168.1.116.443 > 192.168.1.115.60715: Flags [.], cksum 0x8452 (incorrect -> 0x63d5), seq 1, ack 203, win 237, length 0
15:43:05.730517 IP (tos 0x0, ttl 128, id 8665, offset 0, flags [DF], proto TCP (6), length 40)
    192.168.1.115.60717 > 192.168.1.116.443: Flags [.], cksum 0x9cdf (correct), seq 1, ack 1, win 1024, length 0
15:43:05.730726 IP (tos 0x0, ttl 128, id 8666, offset 0, flags [DF], proto TCP (6), length 242)
    192.168.1.115.60716 > 192.168.1.116.443: Flags [P.], cksum 0x54bd (correct), seq 1:203, ack 1, win 1024, length 202
15:43:05.730742 IP (tos 0x0, ttl 64, id 16766, offset 0, flags [DF], proto TCP (6), length 40)
    192.168.1.116.443 > 192.168.1.115.60716: Flags [.], cksum 0x8452 (incorrect -> 0xb90c), seq 1, ack 203, win 237, length 0
15:43:05.730759 IP (tos 0x0, ttl 128, id 8667, offset 0, flags [DF], proto TCP (6), length 242)
    192.168.1.115.60717 > 192.168.1.116.443: Flags [P.], cksum 0x6dfa (correct), seq 1:203, ack 1, win 1024, length 202
15:43:05.730772 IP (tos 0x0, ttl 64, id 8422, offset 0, flags [DF], proto TCP (6), length 40)
    192.168.1.116.443 > 192.168.1.115.60717: Flags [.], cksum 0x8452 (incorrect -> 0x9f28), seq 1, ack 203, win 237, length 0
15:43:05.731172 IP (tos 0x0, ttl 64, id 12528, offset 0, flags [DF], proto TCP (6), length 196)
    192.168.1.116.443 > 192.168.1.115.60714: Flags [P.], cksum 0x84ee (incorrect -> 0x3842), seq 1:157, ack 203, win 237, length 156
15:43:05.731524 IP (tos 0x0, ttl 128, id 8668, offset 0, flags [DF], proto TCP (6), length 40)
    192.168.1.115.60714 > 192.168.1.116.443: Flags [.], cksum 0x17c3 (correct), seq 203, ack 157, win 1023, length 0
15:43:05.731627 IP (tos 0x0, ttl 128, id 8669, offset 0, flags [DF], proto TCP (6), length 91)
    192.168.1.115.60714 > 192.168.1.116.443: Flags [P.], cksum 0x2c54 (correct), seq 203:254, ack 157, win 1023, length 51
15:43:05.732029 IP (tos 0x0, ttl 64, id 14562, offset 0, flags [DF], proto TCP (6), length 196)
    192.168.1.116.443 > 192.168.1.115.60715: Flags [P.], cksum 0x84ee (incorrect -> 0x4b49), seq 1:157, ack 203, win 237, length 156
15:43:05.732142 IP (tos 0x0, ttl 128, id 8670, offset 0, flags [DF], proto TCP (6), length 40)
    192.168.1.115.60715 > 192.168.1.116.443: Flags [.], cksum 0x6027 (correct), seq 203, ack 157, win 1023, length 0
15:43:05.732554 IP (tos 0x0, ttl 64, id 16767, offset 0, flags [DF], proto TCP (6), length 196)
    192.168.1.116.443 > 192.168.1.115.60716: Flags [P.], cksum 0x84ee (incorrect -> 0xdf83), seq 1:157, ack 203, win 237, length 156
15:43:05.732635 IP (tos 0x0, ttl 128, id 8671, offset 0, flags [DF], proto TCP (6), length 40)
    192.168.1.115.60716 > 192.168.1.116.443: Flags [.], cksum 0xb55e (correct), seq 203, ack 157, win 1023, length 0
15:43:05.733002 IP (tos 0x0, ttl 64, id 8423, offset 0, flags [DF], proto TCP (6), length 196)
    192.168.1.116.443 > 192.168.1.115.60717: Flags [P.], cksum 0x84ee (incorrect -> 0xb440), seq 1:157, ack 203, win 237, length 156
15:43:05.733004 IP (tos 0x0, ttl 128, id 8672, offset 0, flags [DF], proto TCP (6), length 40)
    192.168.1.115.60717 > 192.168.1.116.443: Flags [.], cksum 0x9b7a (correct), seq 203, ack 157, win 1023, length 0
15:43:05.733387 IP (tos 0x0, ttl 64, id 5482, offset 0, flags [DF], proto TCP (6), length 1196)
    192.168.1.116.443 > 192.168.1.115.60713: Flags [P.], cksum 0x88d6 (incorrect -> 0x295d), seq 5912:7068, ack 703, win 245, length 1156
15:43:05.733533 IP (tos 0x0, ttl 128, id 8673, offset 0, flags [DF], proto TCP (6), length 40)
    192.168.1.115.60713 > 192.168.1.116.443: Flags [.], cksum 0xaea2 (correct), seq 703, ack 7068, win 1018, length 0
15:43:05.734798 IP (tos 0x0, ttl 128, id 8674, offset 0, flags [DF], proto TCP (6), length 91)
    192.168.1.115.60715 > 192.168.1.116.443: Flags [P.], cksum 0x6694 (correct), seq 203:254, ack 157, win 1023, length 51
15:43:05.734824 IP (tos 0x0, ttl 128, id 8675, offset 0, flags [DF], proto TCP (6), length 533)
    192.168.1.115.60714 > 192.168.1.116.443: Flags [P.], cksum 0xc269 (correct), seq 254:747, ack 157, win 1023, length 493
15:43:05.734841 IP (tos 0x0, ttl 64, id 12529, offset 0, flags [DF], proto TCP (6), length 40)
    192.168.1.116.443 > 192.168.1.115.60714: Flags [.], cksum 0x8452 (incorrect -> 0x18ad), seq 157, ack 747, win 245, length 0
15:43:05.735037 IP (tos 0x0, ttl 128, id 8676, offset 0, flags [DF], proto TCP (6), length 91)
    192.168.1.115.60716 > 192.168.1.116.443: Flags [P.], cksum 0xbe2a (correct), seq 203:254, ack 157, win 1023, length 51
15:43:05.735470 IP (tos 0x0, ttl 128, id 8677, offset 0, flags [DF], proto TCP (6), length 91)
    192.168.1.115.60717 > 192.168.1.116.443: Flags [P.], cksum 0xa481 (correct), seq 203:254, ack 157, win 1023, length 51
15:43:05.735483 IP (tos 0x0, ttl 128, id 8678, offset 0, flags [DF], proto TCP (6), length 552)
    192.168.1.115.60715 > 192.168.1.116.443: Flags [P.], cksum 0x3aca (correct), seq 254:766, ack 157, win 1023, length 512
15:43:05.735494 IP (tos 0x0, ttl 64, id 14563, offset 0, flags [DF], proto TCP (6), length 40)
    192.168.1.116.443 > 192.168.1.115.60715: Flags [.], cksum 0x8452 (incorrect -> 0x60fe), seq 157, ack 766, win 245, length 0
15:43:05.735898 IP (tos 0x0, ttl 128, id 8679, offset 0, flags [DF], proto TCP (6), length 558)
    192.168.1.115.60713 > 192.168.1.116.443: Flags [P.], cksum 0xa30c (correct), seq 703:1221, ack 7068, win 1018, length 518
15:43:05.735912 IP (tos 0x0, ttl 64, id 5483, offset 0, flags [DF], proto TCP (6), length 40)
    192.168.1.116.443 > 192.168.1.115.60713: Flags [.], cksum 0x8452 (incorrect -> 0xaf98), seq 7068, ack 1221, win 254, length 0
15:43:05.736116 IP (tos 0x0, ttl 128, id 8680, offset 0, flags [DF], proto TCP (6), length 40)
    192.168.1.115.60710 > 192.168.1.116.80: Flags [F.], cksum 0x1bb4 (correct), seq 407, ack 691, win 1021, length 0
15:43:05.737138 IP (tos 0x0, ttl 128, id 8681, offset 0, flags [DF], proto TCP (6), length 52)
    192.168.1.115.60718 > 192.168.1.116.443: Flags [S], cksum 0xb88e (correct), seq 1560340063, win 65535, options [mss 1460,nop,wscale 8,nop,nop,sackOK], length 0
15:43:05.737183 IP (tos 0x0, ttl 64, id 0, offset 0, flags [DF], proto TCP (6), length 52)
    192.168.1.116.443 > 192.168.1.115.60718: Flags [S.], cksum 0x845e (incorrect -> 0xa643), seq 2978279077, ack 1560340064, win 29200, options [mss 1460,nop,nop,sackOK,nop,wscale 7], length 0
15:43:05.737931 IP (tos 0x0, ttl 128, id 8682, offset 0, flags [DF], proto TCP (6), length 40)
    192.168.1.115.60718 > 192.168.1.116.443: Flags [.], cksum 0x5526 (correct), seq 1, ack 1, win 1024, length 0
15:43:05.738104 IP (tos 0x0, ttl 128, id 8683, offset 0, flags [DF], proto TCP (6), length 242)
    192.168.1.115.60718 > 192.168.1.116.443: Flags [P.], cksum 0xab63 (correct), seq 1:203, ack 1, win 1024, length 202
15:43:05.738189 IP (tos 0x0, ttl 64, id 6219, offset 0, flags [DF], proto TCP (6), length 40)
    192.168.1.116.443 > 192.168.1.115.60718: Flags [.], cksum 0x8452 (incorrect -> 0x576f), seq 1, ack 203, win 237, length 0
15:43:05.738430 IP (tos 0x0, ttl 64, id 13684, offset 0, flags [DF], proto TCP (6), length 40)
    192.168.1.116.80 > 192.168.1.115.60710: Flags [F.], cksum 0x8452 (incorrect -> 0x1ec3), seq 691, ack 408, win 237, length 0
15:43:05.738664 IP (tos 0x0, ttl 128, id 8684, offset 0, flags [DF], proto TCP (6), length 540)
    192.168.1.115.60716 > 192.168.1.116.443: Flags [P.], cksum 0x7e12 (correct), seq 254:754, ack 157, win 1023, length 500
15:43:05.738708 IP (tos 0x0, ttl 64, id 16768, offset 0, flags [DF], proto TCP (6), length 40)
    192.168.1.116.443 > 192.168.1.115.60716: Flags [.], cksum 0x8452 (incorrect -> 0xb641), seq 157, ack 754, win 245, length 0
15:43:05.738740 IP (tos 0x0, ttl 128, id 8685, offset 0, flags [DF], proto TCP (6), length 40)
    192.168.1.115.60710 > 192.168.1.116.80: Flags [.], cksum 0x1bb3 (correct), seq 408, ack 692, win 1021, length 0
15:43:05.739475 IP (tos 0x0, ttl 64, id 6220, offset 0, flags [DF], proto TCP (6), length 196)
    192.168.1.116.443 > 192.168.1.115.60718: Flags [P.], cksum 0x84ee (incorrect -> 0x5498), seq 1:157, ack 203, win 237, length 156
15:43:05.739555 IP (tos 0x0, ttl 128, id 8686, offset 0, flags [DF], proto TCP (6), length 556)
    192.168.1.115.60717 > 192.168.1.116.443: Flags [P.], cksum 0xa0b7 (correct), seq 254:770, ack 157, win 1023, length 516
15:43:05.739567 IP (tos 0x0, ttl 64, id 8424, offset 0, flags [DF], proto TCP (6), length 40)
    192.168.1.116.443 > 192.168.1.115.60717: Flags [.], cksum 0x8452 (incorrect -> 0x9c4d), seq 157, ack 770, win 245, length 0
15:43:05.739588 IP (tos 0x0, ttl 128, id 8687, offset 0, flags [DF], proto TCP (6), length 40)
    192.168.1.115.60718 > 192.168.1.116.443: Flags [.], cksum 0x53c1 (correct), seq 203, ack 157, win 1023, length 0
15:43:05.739912 IP (tos 0x0, ttl 128, id 8688, offset 0, flags [DF], proto TCP (6), length 91)
    192.168.1.115.60718 > 192.168.1.116.443: Flags [P.], cksum 0x903d (correct), seq 203:254, ack 157, win 1023, length 51
15:43:05.740567 IP (tos 0x0, ttl 128, id 8689, offset 0, flags [DF], proto TCP (6), length 561)
    192.168.1.115.60718 > 192.168.1.116.443: Flags [P.], cksum 0x20ab (correct), seq 254:775, ack 157, win 1023, length 521
15:43:05.749824 IP (tos 0x0, ttl 64, id 14564, offset 0, flags [DF], proto TCP (6), length 4184)
    192.168.1.116.443 > 192.168.1.115.60715: Flags [P.], cksum 0x9482 (incorrect -> 0x303e), seq 157:4301, ack 766, win 245, length 4144
15:43:05.750026 IP (tos 0x0, ttl 128, id 8690, offset 0, flags [DF], proto TCP (6), length 40)
    192.168.1.115.60715 > 192.168.1.116.443: Flags [.], cksum 0x583f (correct), seq 766, ack 1617, win 1024, length 0
15:43:05.750046 IP (tos 0x0, ttl 128, id 8691, offset 0, flags [DF], proto TCP (6), length 40)
    192.168.1.115.60715 > 192.168.1.116.443: Flags [.], cksum 0x528b (correct), seq 766, ack 3077, win 1024, length 0
15:43:05.750053 IP (tos 0x0, ttl 128, id 8692, offset 0, flags [DF], proto TCP (6), length 40)
    192.168.1.115.60715 > 192.168.1.116.443: Flags [.], cksum 0x4dc8 (correct), seq 766, ack 4301, win 1019, length 0
15:43:05.750176 IP (tos 0x0, ttl 64, id 6221, offset 0, flags [DF], proto TCP (6), length 40)
    192.168.1.116.443 > 192.168.1.115.60718: Flags [.], cksum 0x8452 (incorrect -> 0x548f), seq 157, ack 775, win 245, length 0
15:43:05.750767 IP (tos 0x0, ttl 128, id 8693, offset 0, flags [DF], proto TCP (6), length 558)
    192.168.1.115.60715 > 192.168.1.116.443: Flags [P.], cksum 0x3a0a (correct), seq 766:1284, ack 4301, win 1019, length 518
15:43:05.750952 IP (tos 0x0, ttl 64, id 6222, offset 0, flags [DF], proto TCP (6), length 596)
    192.168.1.116.443 > 192.168.1.115.60718: Flags [P.], cksum 0x867e (incorrect -> 0x92ae), seq 157:713, ack 775, win 245, length 556
15:43:05.751095 IP (tos 0x0, ttl 128, id 8694, offset 0, flags [DF], proto TCP (6), length 40)
    192.168.1.115.60718 > 192.168.1.116.443: Flags [.], cksum 0x4f5b (correct), seq 775, ack 713, win 1021, length 0
15:43:05.751266 IP (tos 0x0, ttl 128, id 8695, offset 0, flags [DF], proto TCP (6), length 568)
    192.168.1.115.60718 > 192.168.1.116.443: Flags [P.], cksum 0x078b (correct), seq 775:1303, ack 713, win 1021, length 528
15:43:05.751530 IP (tos 0x0, ttl 64, id 14567, offset 0, flags [DF], proto TCP (6), length 615)
    192.168.1.116.443 > 192.168.1.115.60715: Flags [P.], cksum 0x8691 (incorrect -> 0x75f6), seq 4301:4876, ack 1284, win 254, length 575
15:43:05.751682 IP (tos 0x0, ttl 128, id 8696, offset 0, flags [DF], proto TCP (6), length 40)
    192.168.1.115.60715 > 192.168.1.116.443: Flags [.], cksum 0x497e (correct), seq 1284, ack 4876, win 1024, length 0
15:43:05.751834 IP (tos 0x0, ttl 128, id 8697, offset 0, flags [DF], proto TCP (6), length 558)
    192.168.1.115.60715 > 192.168.1.116.443: Flags [P.], cksum 0x2568 (correct), seq 1284:1802, ack 4876, win 1024, length 518
15:43:05.753449 IP (tos 0x0, ttl 64, id 14568, offset 0, flags [DF], proto TCP (6), length 706)
    192.168.1.116.443 > 192.168.1.115.60715: Flags [P.], cksum 0x86ec (incorrect -> 0xd372), seq 4876:5542, ack 1802, win 262, length 666
15:43:05.753632 IP (tos 0x0, ttl 128, id 8698, offset 0, flags [DF], proto TCP (6), length 40)
    192.168.1.115.60715 > 192.168.1.116.443: Flags [.], cksum 0x44e1 (correct), seq 1802, ack 5542, win 1021, length 0
15:43:05.753806 IP (tos 0x0, ttl 128, id 8699, offset 0, flags [DF], proto TCP (6), length 557)
    192.168.1.115.60715 > 192.168.1.116.443: Flags [P.], cksum 0xffd5 (correct), seq 1802:2319, ack 5542, win 1021, length 517
15:43:05.757403 IP (tos 0x0, ttl 64, id 14569, offset 0, flags [DF], proto TCP (6), length 807)
    192.168.1.116.443 > 192.168.1.115.60715: Flags [P.], cksum 0x8751 (incorrect -> 0xc571), seq 5542:6309, ack 2319, win 270, length 767
15:43:05.757545 IP (tos 0x0, ttl 128, id 8700, offset 0, flags [DF], proto TCP (6), length 40)
    192.168.1.115.60715 > 192.168.1.116.443: Flags [.], cksum 0x3fe0 (correct), seq 2319, ack 6309, win 1018, length 0
15:43:05.757688 IP (tos 0x0, ttl 128, id 8701, offset 0, flags [DF], proto TCP (6), length 560)
    192.168.1.115.60715 > 192.168.1.116.443: Flags [P.], cksum 0x71df (correct), seq 2319:2839, ack 6309, win 1018, length 520
15:43:05.757887 IP (tos 0x0, ttl 64, id 5484, offset 0, flags [DF], proto TCP (6), length 788)
    192.168.1.116.443 > 192.168.1.115.60713: Flags [P.], cksum 0x873e (incorrect -> 0xf38b), seq 7068:7816, ack 1221, win 254, length 748
15:43:05.758022 IP (tos 0x0, ttl 128, id 8702, offset 0, flags [DF], proto TCP (6), length 40)
    192.168.1.115.60713 > 192.168.1.116.443: Flags [.], cksum 0xa9aa (correct), seq 1221, ack 7816, win 1024, length 0
15:43:05.758239 IP (tos 0x0, ttl 64, id 14570, offset 0, flags [DF], proto TCP (6), length 714)
    192.168.1.116.443 > 192.168.1.115.60715: Flags [P.], cksum 0x86f4 (incorrect -> 0x6347), seq 6309:6983, ack 2839, win 279, length 674
15:43:05.758750 IP (tos 0x0, ttl 128, id 8703, offset 0, flags [DF], proto TCP (6), length 40)
    192.168.1.115.60715 > 192.168.1.116.443: Flags [.], cksum 0x3b30 (correct), seq 2839, ack 6983, win 1024, length 0
15:43:05.793244 IP (tos 0x0, ttl 64, id 6223, offset 0, flags [DF], proto TCP (6), length 40)
    192.168.1.116.443 > 192.168.1.115.60718: Flags [.], cksum 0x8452 (incorrect -> 0x504a), seq 713, ack 1303, win 254, length 0
15:43:05.795166 IP (tos 0x0, ttl 64, id 6224, offset 0, flags [DF], proto TCP (6), length 584)
    192.168.1.116.443 > 192.168.1.115.60718: Flags [P.], cksum 0x8672 (incorrect -> 0x0548), seq 713:1257, ack 1303, win 254, length 544
15:43:05.795352 IP (tos 0x0, ttl 128, id 8704, offset 0, flags [DF], proto TCP (6), length 40)
    192.168.1.115.60718 > 192.168.1.116.443: Flags [.], cksum 0x4b2d (correct), seq 1303, ack 1257, win 1019, length 0
15:43:05.795471 IP (tos 0x0, ttl 128, id 8705, offset 0, flags [DF], proto TCP (6), length 40)
    192.168.1.115.60718 > 192.168.1.116.443: Flags [F.], cksum 0x4b2c (correct), seq 1303, ack 1257, win 1019, length 0
15:43:05.811102 IP (tos 0x0, ttl 64, id 6225, offset 0, flags [DF], proto TCP (6), length 71)
    192.168.1.116.443 > 192.168.1.115.60718: Flags [P.], cksum 0x8471 (incorrect -> 0xac23), seq 1257:1288, ack 1304, win 254, length 31
15:43:05.811224 IP (tos 0x0, ttl 64, id 6226, offset 0, flags [DF], proto TCP (6), length 40)
    192.168.1.116.443 > 192.168.1.115.60718: Flags [F.], cksum 0x8452 (incorrect -> 0x4e09), seq 1288, ack 1304, win 254, length 0
15:43:05.811337 IP (tos 0x0, ttl 128, id 8706, offset 0, flags [DF], proto TCP (6), length 40)
    192.168.1.115.60718 > 192.168.1.116.443: Flags [R.], cksum 0x4f04 (correct), seq 1304, ack 1288, win 0, length 0
15:43:05.839067 IP (tos 0x0, ttl 64, id 16769, offset 0, flags [DF], proto TCP (6), length 7340)
    192.168.1.116.443 > 192.168.1.115.60716: Flags [.], cksum 0xa0d6 (incorrect -> 0x6a47), seq 157:7457, ack 754, win 245, length 7300
15:43:05.839168 IP (tos 0x0, ttl 64, id 16774, offset 0, flags [DF], proto TCP (6), length 1384)
    192.168.1.116.443 > 192.168.1.115.60716: Flags [P.], cksum 0x8992 (incorrect -> 0x1882), seq 7457:8801, ack 754, win 245, length 1344
15:43:05.839214 IP (tos 0x0, ttl 64, id 16775, offset 0, flags [DF], proto TCP (6), length 5880)
    192.168.1.116.443 > 192.168.1.115.60716: Flags [.], cksum 0x9b22 (incorrect -> 0xad2d), seq 8801:14641, ack 754, win 245, length 5840
15:43:05.839313 IP (tos 0x0, ttl 128, id 8707, offset 0, flags [DF], proto TCP (6), length 40)
    192.168.1.115.60716 > 192.168.1.116.443: Flags [.], cksum 0xad82 (correct), seq 754, ack 1617, win 1024, length 0
15:43:05.839330 IP (tos 0x0, ttl 128, id 8708, offset 0, flags [DF], proto TCP (6), length 40)
    192.168.1.115.60716 > 192.168.1.116.443: Flags [.], cksum 0xa7ce (correct), seq 754, ack 3077, win 1024, length 0
15:43:05.839346 IP (tos 0x0, ttl 64, id 16779, offset 0, flags [DF], proto TCP (6), length 2325)
    192.168.1.116.443 > 192.168.1.115.60716: Flags [P.], cksum 0x8d3f (incorrect -> 0x7162), seq 14641:16926, ack 754, win 245, length 2285
15:43:05.839367 IP (tos 0x0, ttl 128, id 8709, offset 0, flags [DF], proto TCP (6), length 40)
    192.168.1.115.60716 > 192.168.1.116.443: Flags [.], cksum 0xa21a (correct), seq 754, ack 4537, win 1024, length 0
15:43:05.839373 IP (tos 0x0, ttl 128, id 8710, offset 0, flags [DF], proto TCP (6), length 40)
    192.168.1.115.60716 > 192.168.1.116.443: Flags [.], cksum 0x9c66 (correct), seq 754, ack 5997, win 1024, length 0
15:43:05.839377 IP (tos 0x0, ttl 128, id 8711, offset 0, flags [DF], proto TCP (6), length 40)
    192.168.1.115.60716 > 192.168.1.116.443: Flags [.], cksum 0x96b2 (correct), seq 754, ack 7457, win 1024, length 0
15:43:05.839525 IP (tos 0x0, ttl 128, id 8712, offset 0, flags [DF], proto TCP (6), length 40)
    192.168.1.115.60716 > 192.168.1.116.443: Flags [.], cksum 0x9178 (correct), seq 754, ack 8801, win 1018, length 0
15:43:05.839530 IP (tos 0x0, ttl 128, id 8713, offset 0, flags [DF], proto TCP (6), length 40)
    192.168.1.115.60716 > 192.168.1.116.443: Flags [.], cksum 0x8bbe (correct), seq 754, ack 10261, win 1024, length 0
15:43:05.839533 IP (tos 0x0, ttl 128, id 8714, offset 0, flags [DF], proto TCP (6), length 40)
    192.168.1.115.60716 > 192.168.1.116.443: Flags [.], cksum 0x860a (correct), seq 754, ack 11721, win 1024, length 0
15:43:05.839536 IP (tos 0x0, ttl 128, id 8715, offset 0, flags [DF], proto TCP (6), length 40)
    192.168.1.115.60716 > 192.168.1.116.443: Flags [.], cksum 0x8056 (correct), seq 754, ack 13181, win 1024, length 0
15:43:05.839540 IP (tos 0x0, ttl 128, id 8716, offset 0, flags [DF], proto TCP (6), length 40)
    192.168.1.115.60716 > 192.168.1.116.443: Flags [.], cksum 0x7aa2 (correct), seq 754, ack 14641, win 1024, length 0
15:43:05.839582 IP (tos 0x0, ttl 64, id 16781, offset 0, flags [DF], proto TCP (6), length 10260)
    192.168.1.116.443 > 192.168.1.115.60716: Flags [.], cksum 0xac3e (incorrect -> 0x7174), seq 16926:27146, ack 754, win 245, length 10220
15:43:05.839665 IP (tos 0x0, ttl 128, id 8717, offset 0, flags [DF], proto TCP (6), length 40)
    192.168.1.115.60716 > 192.168.1.116.443: Flags [.], cksum 0x74ee (correct), seq 754, ack 16101, win 1024, length 0
15:43:05.839671 IP (tos 0x0, ttl 128, id 8718, offset 0, flags [DF], proto TCP (6), length 40)
    192.168.1.115.60716 > 192.168.1.116.443: Flags [.], cksum 0x71b9 (correct), seq 754, ack 16926, win 1020, length 0
15:43:05.839674 IP (tos 0x0, ttl 128, id 8719, offset 0, flags [DF], proto TCP (6), length 40)
    192.168.1.115.60716 > 192.168.1.116.443: Flags [.], cksum 0x6c01 (correct), seq 754, ack 18386, win 1024, length 0
15:43:05.839677 IP (tos 0x0, ttl 128, id 8720, offset 0, flags [DF], proto TCP (6), length 40)
    192.168.1.115.60716 > 192.168.1.116.443: Flags [.], cksum 0x664d (correct), seq 754, ack 19846, win 1024, length 0
15:43:05.839765 IP (tos 0x0, ttl 128, id 8721, offset 0, flags [DF], proto TCP (6), length 40)
    192.168.1.115.60716 > 192.168.1.116.443: Flags [.], cksum 0x6099 (correct), seq 754, ack 21306, win 1024, length 0
15:43:05.839771 IP (tos 0x0, ttl 128, id 8722, offset 0, flags [DF], proto TCP (6), length 40)
    192.168.1.115.60716 > 192.168.1.116.443: Flags [.], cksum 0x5ae5 (correct), seq 754, ack 22766, win 1024, length 0
15:43:05.839774 IP (tos 0x0, ttl 128, id 8723, offset 0, flags [DF], proto TCP (6), length 40)
    192.168.1.115.60716 > 192.168.1.116.443: Flags [.], cksum 0x5531 (correct), seq 754, ack 24226, win 1024, length 0
15:43:05.839777 IP (tos 0x0, ttl 128, id 8724, offset 0, flags [DF], proto TCP (6), length 40)
    192.168.1.115.60716 > 192.168.1.116.443: Flags [.], cksum 0x4f7d (correct), seq 754, ack 25686, win 1024, length 0
15:43:05.839859 IP (tos 0x0, ttl 64, id 16788, offset 0, flags [DF], proto TCP (6), length 6070)
    192.168.1.116.443 > 192.168.1.115.60716: Flags [P.], cksum 0x9be0 (incorrect -> 0xb28d), seq 27146:33176, ack 754, win 245, length 6030
15:43:05.839877 IP (tos 0x0, ttl 128, id 8725, offset 0, flags [DF], proto TCP (6), length 40)
    192.168.1.115.60716 > 192.168.1.116.443: Flags [.], cksum 0x49c9 (correct), seq 754, ack 27146, win 1024, length 0
15:43:05.839958 IP (tos 0x0, ttl 128, id 8726, offset 0, flags [DF], proto TCP (6), length 40)
    192.168.1.115.60716 > 192.168.1.116.443: Flags [.], cksum 0x4415 (correct), seq 754, ack 28606, win 1024, length 0
15:43:05.839963 IP (tos 0x0, ttl 128, id 8727, offset 0, flags [DF], proto TCP (6), length 40)
    192.168.1.115.60716 > 192.168.1.116.443: Flags [.], cksum 0x3e61 (correct), seq 754, ack 30066, win 1024, length 0
15:43:05.840050 IP (tos 0x0, ttl 128, id 8728, offset 0, flags [DF], proto TCP (6), length 40)
    192.168.1.115.60716 > 192.168.1.116.443: Flags [.], cksum 0x38ad (correct), seq 754, ack 31526, win 1024, length 0
15:43:05.840055 IP (tos 0x0, ttl 128, id 8729, offset 0, flags [DF], proto TCP (6), length 40)
    192.168.1.115.60716 > 192.168.1.116.443: Flags [.], cksum 0x32f9 (correct), seq 754, ack 32986, win 1024, length 0
15:43:05.840059 IP (tos 0x0, ttl 128, id 8730, offset 0, flags [DF], proto TCP (6), length 40)
    192.168.1.115.60716 > 192.168.1.116.443: Flags [.], cksum 0x323c (correct), seq 754, ack 33176, win 1023, length 0
15:43:05.840143 IP (tos 0x0, ttl 64, id 16793, offset 0, flags [DF], proto TCP (6), length 2465)
    192.168.1.116.443 > 192.168.1.115.60716: Flags [P.], cksum 0x8dcb (incorrect -> 0x33f0), seq 33176:35601, ack 754, win 245, length 2425
15:43:05.840204 IP (tos 0x0, ttl 128, id 8731, offset 0, flags [DF], proto TCP (6), length 40)
    192.168.1.115.60716 > 192.168.1.116.443: Flags [.], cksum 0x2c87 (correct), seq 754, ack 34636, win 1024, length 0
15:43:05.840666 IP (tos 0x0, ttl 128, id 8732, offset 0, flags [DF], proto TCP (6), length 40)
    192.168.1.115.60716 > 192.168.1.116.443: Flags [.], cksum 0x28c6 (correct), seq 754, ack 35601, win 1020, length 0
15:43:05.843111 IP (tos 0x0, ttl 64, id 12530, offset 0, flags [DF], proto TCP (6), length 7340)
    192.168.1.116.443 > 192.168.1.115.60714: Flags [.], cksum 0xa0d6 (incorrect -> 0xfa20), seq 157:7457, ack 747, win 245, length 7300
15:43:05.843234 IP (tos 0x0, ttl 64, id 12535, offset 0, flags [DF], proto TCP (6), length 1395)
    192.168.1.116.443 > 192.168.1.115.60714: Flags [P.], cksum 0x899d (incorrect -> 0xbf6a), seq 7457:8812, ack 747, win 245, length 1355
15:43:05.843245 IP (tos 0x0, ttl 128, id 8733, offset 0, flags [DF], proto TCP (6), length 40)
    192.168.1.115.60714 > 192.168.1.116.443: Flags [.], cksum 0x0fee (correct), seq 747, ack 1617, win 1024, length 0
15:43:05.843251 IP (tos 0x0, ttl 128, id 8734, offset 0, flags [DF], proto TCP (6), length 40)
    192.168.1.115.60714 > 192.168.1.116.443: Flags [.], cksum 0x0a3a (correct), seq 747, ack 3077, win 1024, length 0
15:43:05.843255 IP (tos 0x0, ttl 128, id 8735, offset 0, flags [DF], proto TCP (6), length 40)
    192.168.1.115.60714 > 192.168.1.116.443: Flags [.], cksum 0x0486 (correct), seq 747, ack 4537, win 1024, length 0
15:43:05.843373 IP (tos 0x0, ttl 128, id 8736, offset 0, flags [DF], proto TCP (6), length 40)
