15:32:54.544333 ARP, Ethernet (len 6), IPv4 (len 4), Request who-has 192.168.1.115 (ec:08:6b:c3:59:f4) tell 192.168.1.1, length 46
15:32:54.653977 ARP, Ethernet (len 6), IPv4 (len 4), Request who-has 192.168.1.116 (ec:08:6b:c3:59:f4) tell 192.168.1.1, length 46
15:32:54.653994 ARP, Ethernet (len 6), IPv4 (len 4), Reply 192.168.1.116 is-at 08:00:27:53:84:de, length 28
15:32:54.661689 IP (tos 0x0, ttl 64, id 0, offset 0, flags [DF], proto UDP (17), length 78)
    192.168.1.1.59415 > 192.168.1.116.137: [udp sum ok] 
>>> NBT UDP PACKET(137): QUERY; REQUEST; UNICAST
TrnID=0x3E8
OpCode=0
NmFlags=0x0
Rcode=0
QueryCount=1
AnswerCount=0
AuthorityCount=0
AddressRecCount=0
QuestionRecords:
Name=*               NameType=0x00 (Workstation)
QuestionType=0x21
QuestionClass=0x1


15:32:55.323303 ARP, Ethernet (len 6), IPv4 (len 4), Request who-has 192.168.1.111 tell 192.168.1.115, length 46
15:32:55.716068 ARP, Ethernet (len 6), IPv4 (len 4), Request who-has 192.168.1.115 (ec:08:6b:c3:59:f4) tell 192.168.1.1, length 46
15:32:55.840716 ARP, Ethernet (len 6), IPv4 (len 4), Request who-has 192.168.1.116 (ec:08:6b:c3:59:f4) tell 192.168.1.1, length 46
15:32:55.840732 ARP, Ethernet (len 6), IPv4 (len 4), Reply 192.168.1.116 is-at 08:00:27:53:84:de, length 28
15:32:55.846694 IP (tos 0x0, ttl 64, id 0, offset 0, flags [DF], proto UDP (17), length 78)
    192.168.1.1.44456 > 192.168.1.116.137: [udp sum ok] 
>>> NBT UDP PACKET(137): QUERY; REQUEST; UNICAST
TrnID=0x3E8
OpCode=0
NmFlags=0x0
Rcode=0
QueryCount=1
AnswerCount=0
AuthorityCount=0
AddressRecCount=0
QuestionRecords:
Name=*               NameType=0x00 (Workstation)
QuestionType=0x21
QuestionClass=0x1


15:32:56.292606 ARP, Ethernet (len 6), IPv4 (len 4), Request who-has 192.168.1.111 tell 192.168.1.115, length 46
15:32:56.920426 ARP, Ethernet (len 6), IPv4 (len 4), Request who-has 192.168.1.115 (ec:08:6b:c3:59:f4) tell 192.168.1.1, length 46
15:32:56.988856 IP6 (hlim 255, next-header ICMPv6 (58) payload length: 32) fe80::b2be:76ff:fe6e:a8da > ff02::1: [icmp6 sum ok] ICMP6, router advertisement, length 32
	hop limit 64, Flags [managed, other stateful], pref medium, router lifetime 0s, reachable time 0s, retrans time 0s
	  mtu option (5), length 8 (1):  1500
	    0x0000:  0000 0000 05dc
	  source link-address option (1), length 8 (1): b0:be:76:6e:a8:da
	    0x0000:  b0be 766e a8da
15:32:57.032479 ARP, Ethernet (len 6), IPv4 (len 4), Request who-has 192.168.1.116 (ec:08:6b:c3:59:f4) tell 192.168.1.1, length 46
15:32:57.032511 ARP, Ethernet (len 6), IPv4 (len 4), Reply 192.168.1.116 is-at 08:00:27:53:84:de, length 28
15:32:57.037715 IP (tos 0x0, ttl 64, id 0, offset 0, flags [DF], proto UDP (17), length 78)
    192.168.1.1.45764 > 192.168.1.116.137: [udp sum ok] 
>>> NBT UDP PACKET(137): QUERY; REQUEST; UNICAST
TrnID=0x3E8
OpCode=0
NmFlags=0x0
Rcode=0
QueryCount=1
AnswerCount=0
AuthorityCount=0
AddressRecCount=0
QuestionRecords:
Name=*               NameType=0x00 (Workstation)
QuestionType=0x21
QuestionClass=0x1


15:32:57.291949 ARP, Ethernet (len 6), IPv4 (len 4), Request who-has 192.168.1.111 tell 192.168.1.115, length 46
15:32:57.910392 IP (tos 0x0, ttl 1, id 49708, offset 0, flags [none], proto UDP (17), length 153)
    192.168.1.103.62074 > 239.255.255.250.1900: [udp sum ok] UDP, length 125
15:32:58.012447 IP (tos 0x0, ttl 1, id 6542, offset 0, flags [none], proto UDP (17), length 78)
    192.168.1.104.137 > 224.0.0.252.137: [udp sum ok] 
>>> NBT UDP PACKET(137): QUERY; REQUEST; UNICAST
TrnID=0xBCA0
OpCode=0
NmFlags=0x0
Rcode=0
QueryCount=1
AnswerCount=0
AuthorityCount=0
AddressRecCount=0
QuestionRecords:
Name=*               NameType=0x00 (Workstation)
QuestionType=0x21
QuestionClass=0x1


15:32:58.012809 IP (tos 0x0, ttl 1, id 6543, offset 0, flags [none], proto UDP (17), length 70)
    192.168.1.104.60383 > 224.0.0.252.5355: [udp sum ok] UDP, length 42
15:32:58.013094 IP (tos 0x0, ttl 1, id 19685, offset 0, flags [none], proto UDP (17), length 153)
    192.168.1.103.62074 > 239.255.255.250.1900: [udp sum ok] UDP, length 125
15:32:58.105367 ARP, Ethernet (len 6), IPv4 (len 4), Request who-has 192.168.1.115 (ec:08:6b:c3:59:f4) tell 192.168.1.1, length 46
15:32:58.232982 ARP, Ethernet (len 6), IPv4 (len 4), Request who-has 192.168.1.116 (ec:08:6b:c3:59:f4) tell 192.168.1.1, length 46
15:32:58.232998 ARP, Ethernet (len 6), IPv4 (len 4), Reply 192.168.1.116 is-at 08:00:27:53:84:de, length 28
15:32:58.240681 IP (tos 0x0, ttl 64, id 0, offset 0, flags [DF], proto UDP (17), length 78)
    192.168.1.1.52168 > 192.168.1.116.137: [udp sum ok] 
>>> NBT UDP PACKET(137): QUERY; REQUEST; UNICAST
TrnID=0x3E8
OpCode=0
NmFlags=0x0
Rcode=0
QueryCount=1
AnswerCount=0
AuthorityCount=0
AddressRecCount=0
QuestionRecords:
Name=*               NameType=0x00 (Workstation)
QuestionType=0x21
QuestionClass=0x1


15:32:58.324034 ARP, Ethernet (len 6), IPv4 (len 4), Request who-has 192.168.1.111 tell 192.168.1.115, length 46
15:32:58.422212 IP6 (flowlabel 0x9b240, hlim 1, next-header UDP (17) payload length: 50) fe80::18d:9490:aebb:a846.60383 > ff02::1:3.5355: [udp sum ok] UDP, length 42
15:32:59.293248 ARP, Ethernet (len 6), IPv4 (len 4), Request who-has 192.168.1.111 tell 192.168.1.115, length 46
15:32:59.295070 ARP, Ethernet (len 6), IPv4 (len 4), Request who-has 192.168.1.115 (ec:08:6b:c3:59:f4) tell 192.168.1.1, length 46
15:32:59.416421 ARP, Ethernet (len 6), IPv4 (len 4), Request who-has 192.168.1.116 (ec:08:6b:c3:59:f4) tell 192.168.1.1, length 46
15:32:59.416437 ARP, Ethernet (len 6), IPv4 (len 4), Reply 192.168.1.116 is-at 08:00:27:53:84:de, length 28
15:32:59.423735 IP (tos 0x0, ttl 64, id 0, offset 0, flags [DF], proto UDP (17), length 78)
    192.168.1.1.59583 > 192.168.1.116.137: [udp sum ok] 
>>> NBT UDP PACKET(137): QUERY; REQUEST; UNICAST
TrnID=0x3E8
OpCode=0
NmFlags=0x0
Rcode=0
QueryCount=1
AnswerCount=0
AuthorityCount=0
AddressRecCount=0
QuestionRecords:
Name=*               NameType=0x00 (Workstation)
QuestionType=0x21
QuestionClass=0x1


15:33:00.292129 ARP, Ethernet (len 6), IPv4 (len 4), Request who-has 192.168.1.111 tell 192.168.1.115, length 46
15:33:00.490602 ARP, Ethernet (len 6), IPv4 (len 4), Request who-has 192.168.1.115 (ec:08:6b:c3:59:f4) tell 192.168.1.1, length 46
15:33:00.606480 ARP, Ethernet (len 6), IPv4 (len 4), Request who-has 192.168.1.116 (ec:08:6b:c3:59:f4) tell 192.168.1.1, length 46
15:33:00.606496 ARP, Ethernet (len 6), IPv4 (len 4), Reply 192.168.1.116 is-at 08:00:27:53:84:de, length 28
15:33:00.612695 IP (tos 0x0, ttl 64, id 0, offset 0, flags [DF], proto UDP (17), length 78)
    192.168.1.1.44079 > 192.168.1.116.137: [udp sum ok] 
>>> NBT UDP PACKET(137): QUERY; REQUEST; UNICAST
TrnID=0x3E8
OpCode=0
NmFlags=0x0
Rcode=0
QueryCount=1
AnswerCount=0
AuthorityCount=0
AddressRecCount=0
QuestionRecords:
Name=*               NameType=0x00 (Workstation)
QuestionType=0x21
QuestionClass=0x1


15:33:00.982076 IP (tos 0x0, ttl 1, id 6546, offset 0, flags [none], proto UDP (17), length 78)
    192.168.1.104.137 > 224.0.0.252.137: [udp sum ok] 
>>> NBT UDP PACKET(137): QUERY; REQUEST; BROADCAST
TrnID=0xBCA0
OpCode=0
NmFlags=0x1
Rcode=0
QueryCount=1
AnswerCount=0
AuthorityCount=0
AddressRecCount=0
QuestionRecords:
Name=*               NameType=0x00 (Workstation)
QuestionType=0x21
QuestionClass=0x1


15:33:01.213079 ARP, Ethernet (len 6), IPv4 (len 4), Request who-has 192.168.1.116 tell 192.168.1.115, length 46
15:33:01.213107 ARP, Ethernet (len 6), IPv4 (len 4), Reply 192.168.1.116 is-at 08:00:27:53:84:de, length 28
15:33:01.213252 IP (tos 0x0, ttl 128, id 7709, offset 0, flags [DF], proto TCP (6), length 52)
    192.168.1.115.60584 > 192.168.1.116.443: Flags [S], cksum 0xfc83 (correct), seq 3540069615, win 65535, options [mss 1460,nop,wscale 8,nop,nop,sackOK], length 0
15:33:01.213310 IP (tos 0x0, ttl 64, id 0, offset 0, flags [DF], proto TCP (6), length 52)
    192.168.1.116.443 > 192.168.1.115.60584: Flags [S.], cksum 0x845e (incorrect -> 0x537c), seq 4127080680, ack 3540069616, win 29200, options [mss 1460,nop,nop,sackOK,nop,wscale 7], length 0
15:33:01.213577 IP (tos 0x0, ttl 128, id 7710, offset 0, flags [DF], proto TCP (6), length 40)
    192.168.1.115.60584 > 192.168.1.116.443: Flags [.], cksum 0x025f (correct), seq 1, ack 1, win 1024, length 0
15:33:01.218093 IP (tos 0x0, ttl 128, id 7711, offset 0, flags [DF], proto TCP (6), length 210)
    192.168.1.115.60584 > 192.168.1.116.443: Flags [P.], cksum 0x2b9c (correct), seq 1:171, ack 1, win 1024, length 170
15:33:01.218152 IP (tos 0x0, ttl 64, id 59514, offset 0, flags [DF], proto TCP (6), length 40)
    192.168.1.116.443 > 192.168.1.115.60584: Flags [.], cksum 0x8452 (incorrect -> 0x04c8), seq 1, ack 171, win 237, length 0
15:33:01.230535 IP (tos 0x0, ttl 64, id 59515, offset 0, flags [DF], proto TCP (6), length 1488)
    192.168.1.116.443 > 192.168.1.115.60584: Flags [P.], cksum 0x89fa (incorrect -> 0x02b4), seq 1:1449, ack 171, win 237, length 1448
15:33:01.230714 IP (tos 0x0, ttl 128, id 7712, offset 0, flags [DF], proto TCP (6), length 40)
    192.168.1.115.60584 > 192.168.1.116.443: Flags [.], cksum 0xfc12 (correct), seq 171, ack 1449, win 1018, length 0
15:33:01.257228 IP (tos 0x0, ttl 128, id 7713, offset 0, flags [DF], proto TCP (6), length 40)
    192.168.1.115.60584 > 192.168.1.116.443: Flags [F.], cksum 0xfc11 (correct), seq 171, ack 1449, win 1018, length 0
15:33:01.257427 IP (tos 0x0, ttl 64, id 59516, offset 0, flags [DF], proto TCP (6), length 40)
    192.168.1.116.443 > 192.168.1.115.60584: Flags [F.], cksum 0x8452 (incorrect -> 0xff1d), seq 1449, ack 172, win 237, length 0
15:33:01.257600 IP (tos 0x0, ttl 128, id 7714, offset 0, flags [DF], proto TCP (6), length 40)
    192.168.1.115.60584 > 192.168.1.116.443: Flags [.], cksum 0xfc10 (correct), seq 172, ack 1450, win 1018, length 0
15:33:01.676684 ARP, Ethernet (len 6), IPv4 (len 4), Request who-has 192.168.1.115 (ec:08:6b:c3:59:f4) tell 192.168.1.1, length 46
15:33:01.792443 ARP, Ethernet (len 6), IPv4 (len 4), Request who-has 192.168.1.116 (ec:08:6b:c3:59:f4) tell 192.168.1.1, length 46
15:33:01.792458 ARP, Ethernet (len 6), IPv4 (len 4), Reply 192.168.1.116 is-at 08:00:27:53:84:de, length 28
15:33:01.800267 IP (tos 0x0, ttl 64, id 0, offset 0, flags [DF], proto UDP (17), length 78)
    192.168.1.1.33333 > 192.168.1.116.137: [udp sum ok] 
>>> NBT UDP PACKET(137): QUERY; REQUEST; UNICAST
TrnID=0x3E8
OpCode=0
NmFlags=0x0
Rcode=0
QueryCount=1
AnswerCount=0
AuthorityCount=0
AddressRecCount=0
QuestionRecords:
Name=*               NameType=0x00 (Workstation)
QuestionType=0x21
QuestionClass=0x1


15:33:02.518227 IP6 (flowlabel 0x205cb, hlim 1, next-header UDP (17) payload length: 98) fe80::18d:9490:aebb:a846.59557 > ff02::1:3.5355: [udp sum ok] UDP, length 90
15:33:02.883824 ARP, Ethernet (len 6), IPv4 (len 4), Request who-has 192.168.1.115 (ec:08:6b:c3:59:f4) tell 192.168.1.1, length 46
15:33:02.928336 IP (tos 0x0, ttl 1, id 6548, offset 0, flags [none], proto UDP (17), length 118)
    192.168.1.104.59557 > 224.0.0.252.5355: [udp sum ok] UDP, length 90
15:33:02.997413 ARP, Ethernet (len 6), IPv4 (len 4), Request who-has 192.168.1.116 (ec:08:6b:c3:59:f4) tell 192.168.1.1, length 46
15:33:02.997429 ARP, Ethernet (len 6), IPv4 (len 4), Reply 192.168.1.116 is-at 08:00:27:53:84:de, length 28
15:33:03.002618 IP (tos 0x0, ttl 64, id 0, offset 0, flags [DF], proto UDP (17), length 78)
    192.168.1.1.50342 > 192.168.1.116.137: [udp sum ok] 
>>> NBT UDP PACKET(137): QUERY; REQUEST; UNICAST
TrnID=0x3E8
OpCode=0
NmFlags=0x0
Rcode=0
QueryCount=1
AnswerCount=0
AuthorityCount=0
AddressRecCount=0
QuestionRecords:
Name=*               NameType=0x00 (Workstation)
QuestionType=0x21
QuestionClass=0x1


15:33:05.488187 IP6 (hlim 255, next-header ICMPv6 (58) payload length: 32) fe80::b2be:76ff:fe6e:a8da > ff02::1: [icmp6 sum ok] ICMP6, router advertisement, length 32
	hop limit 64, Flags [managed, other stateful], pref medium, router lifetime 0s, reachable time 0s, retrans time 0s
	  mtu option (5), length 8 (1):  1500
	    0x0000:  0000 0000 05dc
	  source link-address option (1), length 8 (1): b0:be:76:6e:a8:da
	    0x0000:  b0be 766e a8da
15:33:05.795491 IP (tos 0x0, ttl 64, id 0, offset 0, flags [DF], proto UDP (17), length 201)
    192.168.1.1.47853 > 255.255.255.255.7437: [udp sum ok] UDP, length 173
15:33:06.261561 ARP, Ethernet (len 6), IPv4 (len 4), Request who-has 192.168.1.115 tell 192.168.1.116, length 28
15:33:06.261831 ARP, Ethernet (len 6), IPv4 (len 4), Reply 192.168.1.115 is-at ec:08:6b:c3:59:f4, length 46
15:33:07.945428 IP (tos 0x0, ttl 1, id 5582, offset 0, flags [none], proto UDP (17), length 153)
    192.168.1.103.62074 > 239.255.255.250.1900: [udp sum ok] UDP, length 125
15:33:08.150844 IP (tos 0x0, ttl 1, id 13483, offset 0, flags [none], proto UDP (17), length 153)
    192.168.1.103.62074 > 239.255.255.250.1900: [udp sum ok] UDP, length 125
15:33:11.120729 IP6 (flowlabel 0xef477, hlim 255, next-header UDP (17) payload length: 155) fe80::c3a:362a:894b:c1a2.5353 > ff02::fb.5353: [udp sum ok] 0 [1a] [3q] [1au] PTR (QM)? _companion-link._tcp.local. PTR (QM)? _homekit._tcp.local. PTR (QM)? _sleep-proxy._udp.local. _companion-link._tcp.local. PTR XuongM-bM-^@M-^Ys iPad air 2._companion-link._tcp.local. ar: . OPT UDPsize=1440 (147)
15:33:11.493351 IP (tos 0x0, ttl 128, id 7715, offset 0, flags [DF], proto TCP (6), length 52)
    192.168.1.115.60585 > 192.168.1.116.443: Flags [S], cksum 0x5269 (correct), seq 106537905, win 65535, options [mss 1460,nop,wscale 8,nop,nop,sackOK], length 0
15:33:11.493405 IP (tos 0x0, ttl 64, id 0, offset 0, flags [DF], proto TCP (6), length 52)
    192.168.1.116.443 > 192.168.1.115.60585: Flags [S.], cksum 0x845e (incorrect -> 0xe94e), seq 2896906830, ack 106537906, win 29200, options [mss 1460,nop,nop,sackOK,nop,wscale 7], length 0
15:33:11.493552 IP (tos 0x0, ttl 128, id 7716, offset 0, flags [DF], proto TCP (6), length 40)
    192.168.1.115.60585 > 192.168.1.116.443: Flags [.], cksum 0x9831 (correct), seq 1, ack 1, win 1024, length 0
15:33:11.493851 IP (tos 0x0, ttl 128, id 7717, offset 0, flags [DF], proto TCP (6), length 210)
    192.168.1.115.60585 > 192.168.1.116.443: Flags [P.], cksum 0x2ffd (correct), seq 1:171, ack 1, win 1024, length 170
15:33:11.493881 IP (tos 0x0, ttl 64, id 63699, offset 0, flags [DF], proto TCP (6), length 40)
    192.168.1.116.443 > 192.168.1.115.60585: Flags [.], cksum 0x8452 (incorrect -> 0x9a9a), seq 1, ack 171, win 237, length 0
15:33:11.501443 IP (tos 0x0, ttl 64, id 63700, offset 0, flags [DF], proto TCP (6), length 1488)
    192.168.1.116.443 > 192.168.1.115.60585: Flags [P.], cksum 0x89fa (incorrect -> 0xdb52), seq 1:1449, ack 171, win 237, length 1448
15:33:11.501449 IP (tos 0x0, ttl 128, id 7718, offset 0, flags [DF], proto TCP (6), length 40)
    192.168.1.115.60585 > 192.168.1.116.443: Flags [.], cksum 0x91e5 (correct), seq 171, ack 1449, win 1018, length 0
15:33:11.503420 IP (tos 0x0, ttl 128, id 7719, offset 0, flags [DF], proto TCP (6), length 40)
    192.168.1.115.60585 > 192.168.1.116.443: Flags [F.], cksum 0x91e4 (correct), seq 171, ack 1449, win 1018, length 0
15:33:11.503583 IP (tos 0x0, ttl 64, id 63701, offset 0, flags [DF], proto TCP (6), length 40)
    192.168.1.116.443 > 192.168.1.115.60585: Flags [F.], cksum 0x8452 (incorrect -> 0x94f0), seq 1449, ack 172, win 237, length 0
15:33:11.503708 IP (tos 0x0, ttl 128, id 7720, offset 0, flags [DF], proto TCP (6), length 40)
    192.168.1.115.60585 > 192.168.1.116.443: Flags [.], cksum 0x91e3 (correct), seq 172, ack 1450, win 1018, length 0
15:33:11.505297 IP (tos 0x0, ttl 128, id 7721, offset 0, flags [DF], proto TCP (6), length 52)
    192.168.1.115.60586 > 192.168.1.116.443: Flags [S], cksum 0x7eb9 (correct), seq 2300048545, win 65535, options [mss 1460,nop,wscale 8,nop,nop,sackOK], length 0
15:33:11.505351 IP (tos 0x0, ttl 64, id 0, offset 0, flags [DF], proto TCP (6), length 52)
    192.168.1.116.443 > 192.168.1.115.60586: Flags [S.], cksum 0x845e (incorrect -> 0xaa53), seq 2916725867, ack 2300048546, win 29200, options [mss 1460,nop,nop,sackOK,nop,wscale 7], length 0
15:33:11.505505 IP (tos 0x0, ttl 128, id 7722, offset 0, flags [DF], proto TCP (6), length 40)
    192.168.1.115.60586 > 192.168.1.116.443: Flags [.], cksum 0x5936 (correct), seq 1, ack 1, win 1024, length 0
15:33:11.505821 IP (tos 0x0, ttl 128, id 7723, offset 0, flags [DF], proto TCP (6), length 210)
    192.168.1.115.60586 > 192.168.1.116.443: Flags [P.], cksum 0xae7b (correct), seq 1:171, ack 1, win 1024, length 170
15:33:11.505857 IP (tos 0x0, ttl 64, id 1779, offset 0, flags [DF], proto TCP (6), length 40)
    192.168.1.116.443 > 192.168.1.115.60586: Flags [.], cksum 0x8452 (incorrect -> 0x5b9f), seq 1, ack 171, win 237, length 0
15:33:11.510994 IP (tos 0x0, ttl 64, id 1780, offset 0, flags [DF], proto TCP (6), length 1488)
    192.168.1.116.443 > 192.168.1.115.60586: Flags [P.], cksum 0x89fa (incorrect -> 0xfd61), seq 1:1449, ack 171, win 237, length 1448
15:33:11.511157 IP (tos 0x0, ttl 128, id 7724, offset 0, flags [DF], proto TCP (6), length 40)
    192.168.1.115.60586 > 192.168.1.116.443: Flags [.], cksum 0x52ea (correct), seq 171, ack 1449, win 1018, length 0
15:33:11.513333 IP (tos 0x0, ttl 128, id 7725, offset 0, flags [DF], proto TCP (6), length 133)
    192.168.1.115.60586 > 192.168.1.116.443: Flags [P.], cksum 0x9a81 (correct), seq 171:264, ack 1449, win 1018, length 93
15:33:11.513895 IP (tos 0x0, ttl 64, id 1781, offset 0, flags [DF], proto TCP (6), length 91)
    192.168.1.116.443 > 192.168.1.115.60586: Flags [P.], cksum 0x8485 (incorrect -> 0x8d2d), seq 1449:1500, ack 264, win 237, length 51
15:33:11.514062 IP (tos 0x0, ttl 128, id 7726, offset 0, flags [DF], proto TCP (6), length 40)
    192.168.1.115.60586 > 192.168.1.116.443: Flags [.], cksum 0x5254 (correct), seq 264, ack 1500, win 1024, length 0
15:33:11.514470 IP (tos 0x0, ttl 128, id 7727, offset 0, flags [DF], proto TCP (6), length 446)
    192.168.1.115.60586 > 192.168.1.116.443: Flags [P.], cksum 0x74ec (correct), seq 264:670, ack 1500, win 1024, length 406
15:33:11.518045 IP (tos 0x0, ttl 64, id 1782, offset 0, flags [DF], proto TCP (6), length 3660)
    192.168.1.116.443 > 192.168.1.115.60586: Flags [P.], cksum 0x9276 (incorrect -> 0x577d), seq 1500:5120, ack 670, win 245, length 3620
15:33:11.518258 IP (tos 0x0, ttl 128, id 7728, offset 0, flags [DF], proto TCP (6), length 40)
    192.168.1.115.60586 > 192.168.1.116.443: Flags [.], cksum 0x4b0a (correct), seq 670, ack 2960, win 1024, length 0
15:33:11.518273 IP (tos 0x0, ttl 128, id 7729, offset 0, flags [DF], proto TCP (6), length 40)
    192.168.1.115.60586 > 192.168.1.116.443: Flags [.], cksum 0x4556 (correct), seq 670, ack 4420, win 1024, length 0
15:33:11.518278 IP (tos 0x0, ttl 128, id 7730, offset 0, flags [DF], proto TCP (6), length 40)
    192.168.1.115.60586 > 192.168.1.116.443: Flags [.], cksum 0x429d (correct), seq 670, ack 5120, win 1021, length 0
15:33:11.520735 IP (tos 0x0, ttl 128, id 7731, offset 0, flags [DF], proto TCP (6), length 454)
    192.168.1.115.60586 > 192.168.1.116.443: Flags [P.], cksum 0x8073 (correct), seq 670:1084, ack 5120, win 1021, length 414
15:33:11.522124 IP (tos 0x0, ttl 64, id 1785, offset 0, flags [DF], proto TCP (6), length 3777)
    192.168.1.116.443 > 192.168.1.115.60586: Flags [P.], cksum 0x92eb (incorrect -> 0x9990), seq 5120:8857, ack 1084, win 254, length 3737
15:33:11.522326 IP (tos 0x0, ttl 128, id 7732, offset 0, flags [DF], proto TCP (6), length 40)
    192.168.1.115.60586 > 192.168.1.116.443: Flags [.], cksum 0x3b48 (correct), seq 1084, ack 6580, win 1024, length 0
15:33:11.522343 IP (tos 0x0, ttl 128, id 7733, offset 0, flags [DF], proto TCP (6), length 40)
    192.168.1.115.60586 > 192.168.1.116.443: Flags [.], cksum 0x3594 (correct), seq 1084, ack 8040, win 1024, length 0
15:33:11.522348 IP (tos 0x0, ttl 128, id 7734, offset 0, flags [DF], proto TCP (6), length 40)
    192.168.1.115.60586 > 192.168.1.116.443: Flags [.], cksum 0x3267 (correct), seq 1084, ack 8857, win 1020, length 0
15:33:14.601699 IP6 (hlim 255, next-header ICMPv6 (58) payload length: 32) fe80::b2be:76ff:fe6e:a8da > ff02::1: [icmp6 sum ok] ICMP6, router advertisement, length 32
	hop limit 64, Flags [managed, other stateful], pref medium, router lifetime 0s, reachable time 0s, retrans time 0s
	  mtu option (5), length 8 (1):  1500
	    0x0000:  0000 0000 05dc
	  source link-address option (1), length 8 (1): b0:be:76:6e:a8:da
	    0x0000:  b0be 766e a8da
15:33:14.806359 IP (tos 0x0, ttl 64, id 0, offset 0, flags [DF], proto UDP (17), length 201)
    192.168.1.1.47853 > 255.255.255.255.7437: [udp sum ok] UDP, length 173
15:33:15.318737 IP6 (flowlabel 0x6f140, hlim 1, next-header UDP (17) payload length: 50) fe80::18d:9490:aebb:a846.64380 > ff02::1:3.5355: [udp sum ok] UDP, length 42
15:33:15.318846 IP (tos 0x0, ttl 1, id 6550, offset 0, flags [none], proto UDP (17), length 70)
    192.168.1.104.64380 > 224.0.0.252.5355: [udp sum ok] UDP, length 42
15:33:15.728433 IP (tos 0x0, ttl 1, id 6551, offset 0, flags [none], proto UDP (17), length 70)
    192.168.1.104.64380 > 224.0.0.252.5355: [udp sum ok] UDP, length 42
15:33:16.523965 IP (tos 0x0, ttl 64, id 1788, offset 0, flags [DF], proto TCP (6), length 71)
    192.168.1.116.443 > 192.168.1.115.60586: Flags [P.], cksum 0x8471 (incorrect -> 0x3dfc), seq 8857:8888, ack 1084, win 254, length 31
15:33:16.524147 IP (tos 0x0, ttl 128, id 7735, offset 0, flags [DF], proto TCP (6), length 40)
    192.168.1.115.60586 > 192.168.1.116.443: Flags [.], cksum 0x3248 (correct), seq 1084, ack 8888, win 1020, length 0
15:33:16.524272 IP (tos 0x0, ttl 64, id 1789, offset 0, flags [DF], proto TCP (6), length 40)
    192.168.1.116.443 > 192.168.1.115.60586: Flags [F.], cksum 0x8452 (incorrect -> 0x3545), seq 8888, ack 1084, win 254, length 0
15:33:16.524343 IP (tos 0x0, ttl 128, id 7736, offset 0, flags [DF], proto TCP (6), length 40)
    192.168.1.115.60586 > 192.168.1.116.443: Flags [.], cksum 0x3247 (correct), seq 1084, ack 8889, win 1020, length 0
15:33:16.649946 IP (tos 0x0, ttl 2, id 32542, offset 0, flags [none], proto UDP (17), length 89)
    192.168.1.103.5353 > 224.0.0.251.5353: [udp sum ok] 183 [2q] PTR (QM)? _googlecast._tcp.local. PTR (QM)? _233637DE._sub._googlecast._tcp.local. (61)
15:33:16.752087 IP (tos 0x0, ttl 1, id 6552, offset 0, flags [none], proto UDP (17), length 78)
    192.168.1.104.137 > 224.0.0.252.137: [udp sum ok] 
>>> NBT UDP PACKET(137): QUERY; REQUEST; BROADCAST
TrnID=0xBCA1
OpCode=0
NmFlags=0x1
Rcode=0
QueryCount=1
AnswerCount=0
AuthorityCount=0
AddressRecCount=0
QuestionRecords:
Name=*               NameType=0x00 (Workstation)
QuestionType=0x21
QuestionClass=0x1


15:33:17.673756 IP (tos 0x0, ttl 2, id 26826, offset 0, flags [none], proto UDP (17), length 89)
    192.168.1.103.5353 > 224.0.0.251.5353: [udp sum ok] 183 [2q] PTR (QM)? _googlecast._tcp.local. PTR (QM)? _233637DE._sub._googlecast._tcp.local. (61)
15:33:17.776490 IP (tos 0x0, ttl 64, id 0, offset 0, flags [DF], proto UDP (17), length 201)
    192.168.1.1.47853 > 255.255.255.255.7437: [udp sum ok] UDP, length 173
15:33:17.981004 IP (tos 0x0, ttl 1, id 29582, offset 0, flags [none], proto UDP (17), length 153)
    192.168.1.103.62074 > 239.255.255.250.1900: [udp sum ok] UDP, length 125
15:33:18.185359 IP (tos 0x0, ttl 1, id 5729, offset 0, flags [none], proto UDP (17), length 153)
    192.168.1.103.62074 > 239.255.255.250.1900: [udp sum ok] UDP, length 125
15:33:20.234417 IP (tos 0x0, ttl 1, id 6555, offset 0, flags [none], proto UDP (17), length 118)
    192.168.1.104.54153 > 224.0.0.252.5355: [udp sum ok] UDP, length 90
15:33:20.438804 IP6 (hlim 255, next-header ICMPv6 (58) payload length: 32) fe80::b2be:76ff:fe6e:a8da > ff02::1: [icmp6 sum ok] ICMP6, router advertisement, length 32
	hop limit 64, Flags [managed, other stateful], pref medium, router lifetime 0s, reachable time 0s, retrans time 0s
	  mtu option (5), length 8 (1):  1500
	    0x0000:  0000 0000 05dc
	  source link-address option (1), length 8 (1): b0:be:76:6e:a8:da
	    0x0000:  b0be 766e a8da
15:33:23.817678 IP (tos 0x0, ttl 64, id 0, offset 0, flags [DF], proto UDP (17), length 201)
    192.168.1.1.47853 > 255.255.255.255.7437: [udp sum ok] UDP, length 173
15:33:26.787526 IP (tos 0x0, ttl 64, id 0, offset 0, flags [DF], proto UDP (17), length 201)
    192.168.1.1.47853 > 255.255.255.255.7437: [udp sum ok] UDP, length 173
15:33:28.119094 IP (tos 0x0, ttl 1, id 43759, offset 0, flags [none], proto UDP (17), length 153)
    192.168.1.103.62074 > 239.255.255.250.1900: [udp sum ok] UDP, length 125
15:33:29.859937 IP (tos 0x0, ttl 64, id 0, offset 0, flags [DF], proto UDP (17), length 201)
    192.168.1.1.47853 > 255.255.255.255.7437: [udp sum ok] UDP, length 173
15:33:33.034184 IP (tos 0x0, ttl 1, id 6557, offset 0, flags [none], proto UDP (17), length 118)
    192.168.1.104.59227 > 224.0.0.252.5355: [udp sum ok] UDP, length 90
15:33:33.444107 IP6 (flowlabel 0x171d5, hlim 1, next-header UDP (17) payload length: 50) fe80::18d:9490:aebb:a846.56501 > ff02::1:3.5355: [udp sum ok] UDP, length 42
15:33:33.444208 IP (tos 0x0, ttl 1, id 6558, offset 0, flags [none], proto UDP (17), length 70)
    192.168.1.104.56501 > 224.0.0.252.5355: [udp sum ok] UDP, length 42
15:33:33.853518 IP6 (flowlabel 0x171d5, hlim 1, next-header UDP (17) payload length: 50) fe80::18d:9490:aebb:a846.56501 > ff02::1:3.5355: [udp sum ok] UDP, length 42
15:33:33.853668 IP (tos 0x0, ttl 1, id 6559, offset 0, flags [none], proto UDP (17), length 70)
    192.168.1.104.56501 > 224.0.0.252.5355: [udp sum ok] UDP, length 42
15:33:36.413003 IP (tos 0x0, ttl 1, id 59632, offset 0, flags [none], proto UDP (17), length 78)
    192.168.1.104.137 > 224.0.0.251.137: [udp sum ok] 
>>> NBT UDP PACKET(137): QUERY; REQUEST; BROADCAST
TrnID=0xBCA2
OpCode=0
NmFlags=0x1
Rcode=0
QueryCount=1
AnswerCount=0
AuthorityCount=0
AddressRecCount=0
QuestionRecords:
Name=*               NameType=0x00 (Workstation)
QuestionType=0x21
QuestionClass=0x1


15:33:37.948973 IP (tos 0x0, ttl 1, id 46042, offset 0, flags [none], proto UDP (17), length 153)
    192.168.1.103.62074 > 239.255.255.250.1900: [udp sum ok] UDP, length 125
15:33:38.051585 IP (tos 0x0, ttl 1, id 26494, offset 0, flags [none], proto UDP (17), length 153)
    192.168.1.103.62074 > 239.255.255.250.1900: [udp sum ok] UDP, length 125
15:33:42.557654 IP6 (hlim 255, next-header ICMPv6 (58) payload length: 32) fe80::b2be:76ff:fe6e:a8da > ff02::1: [icmp6 sum ok] ICMP6, router advertisement, length 32
	hop limit 64, Flags [managed, other stateful], pref medium, router lifetime 0s, reachable time 0s, retrans time 0s
	  mtu option (5), length 8 (1):  1500
	    0x0000:  0000 0000 05dc
	  source link-address option (1), length 8 (1): b0:be:76:6e:a8:da
	    0x0000:  b0be 766e a8da
15:33:44.810384 IP (tos 0x0, ttl 64, id 0, offset 0, flags [DF], proto UDP (17), length 201)
    192.168.1.1.47853 > 255.255.255.255.7437: [udp sum ok] UDP, length 173
15:33:45.425231 IP6 (flowlabel 0xc7a78, hlim 1, next-header UDP (17) payload length: 50) fe80::18d:9490:aebb:a846.62885 > ff02::1:3.5355: [udp sum ok] UDP, length 42
15:33:45.425343 IP (tos 0x0, ttl 1, id 6560, offset 0, flags [none], proto UDP (17), length 70)
    192.168.1.104.62885 > 224.0.0.252.5355: [udp sum ok] UDP, length 42
15:33:45.834363 IP6 (flowlabel 0xc7a78, hlim 1, next-header UDP (17) payload length: 50) fe80::18d:9490:aebb:a846.62885 > ff02::1:3.5355: [udp sum ok] UDP, length 42
15:33:45.834385 IP (tos 0x0, ttl 1, id 6561, offset 0, flags [none], proto UDP (17), length 70)
    192.168.1.104.62885 > 224.0.0.252.5355: [udp sum ok] UDP, length 42
15:33:46.135955 ARP, Ethernet (len 6), IPv4 (len 4), Request who-has 192.168.1.111 tell 192.168.1.115, length 46
15:33:46.793293 ARP, Ethernet (len 6), IPv4 (len 4), Request who-has 192.168.1.111 tell 192.168.1.115, length 46
15:33:46.960911 IP (tos 0x0, ttl 1, id 59634, offset 0, flags [none], proto UDP (17), length 78)
    192.168.1.104.137 > 224.0.0.251.137: [udp sum ok] 
>>> NBT UDP PACKET(137): QUERY; REQUEST; BROADCAST
TrnID=0xBCA3
OpCode=0
NmFlags=0x1
Rcode=0
QueryCount=1
AnswerCount=0
AuthorityCount=0
AddressRecCount=0
QuestionRecords:
Name=*               NameType=0x00 (Workstation)
QuestionType=0x21
QuestionClass=0x1


15:33:47.792822 ARP, Ethernet (len 6), IPv4 (len 4), Request who-has 192.168.1.111 tell 192.168.1.115, length 46
15:33:47.882793 IP (tos 0x0, ttl 64, id 0, offset 0, flags [DF], proto UDP (17), length 201)
    192.168.1.1.47853 > 255.255.255.255.7437: [udp sum ok] UDP, length 173
15:33:48.087377 IP (tos 0x0, ttl 1, id 46149, offset 0, flags [none], proto UDP (17), length 153)
    192.168.1.103.62074 > 239.255.255.250.1900: [udp sum ok] UDP, length 125
15:33:49.137310 ARP, Ethernet (len 6), IPv4 (len 4), Request who-has 192.168.1.111 tell 192.168.1.115, length 46
15:33:49.793188 ARP, Ethernet (len 6), IPv4 (len 4), Request who-has 192.168.1.111 tell 192.168.1.115, length 46
15:33:50.792831 ARP, Ethernet (len 6), IPv4 (len 4), Request who-has 192.168.1.111 tell 192.168.1.115, length 46
15:33:51.671072 IP6 (hlim 255, next-header ICMPv6 (58) payload length: 32) fe80::b2be:76ff:fe6e:a8da > ff02::1: [icmp6 sum ok] ICMP6, router advertisement, length 32
	hop limit 64, Flags [managed, other stateful], pref medium, router lifetime 0s, reachable time 0s, retrans time 0s
	  mtu option (5), length 8 (1):  1500
	    0x0000:  0000 0000 05dc
	  source link-address option (1), length 8 (1): b0:be:76:6e:a8:da
	    0x0000:  b0be 766e a8da
15:33:52.701380 IP (tos 0x0, ttl 4, id 0, offset 0, flags [DF], proto UDP (17), length 518)
    192.168.1.1.39916 > 239.255.255.250.1900: [udp sum ok] UDP, length 490
15:33:52.702092 IP (tos 0x0, ttl 4, id 0, offset 0, flags [DF], proto UDP (17), length 512)
    192.168.1.1.39916 > 239.255.255.250.1900: [udp sum ok] UDP, length 484
15:33:52.802975 IP (tos 0x0, ttl 4, id 0, offset 0, flags [DF], proto UDP (17), length 530)
    192.168.1.1.39916 > 239.255.255.250.1900: [udp sum ok] UDP, length 502
15:33:52.804513 IP (tos 0x0, ttl 4, id 0, offset 0, flags [DF], proto UDP (17), length 518)
    192.168.1.1.39916 > 239.255.255.250.1900: [udp sum ok] UDP, length 490
15:33:54.173459 IP (tos 0x0, ttl 128, id 7737, offset 0, flags [DF], proto TCP (6), length 40)
    192.168.1.115.60586 > 192.168.1.116.443: Flags [F.], cksum 0x3246 (correct), seq 1084, ack 8889, win 1020, length 0
15:33:54.173503 IP (tos 0x0, ttl 64, id 0, offset 0, flags [DF], proto TCP (6), length 40)
    192.168.1.116.443 > 192.168.1.115.60586: Flags [.], cksum 0x3544 (correct), seq 8889, ack 1085, win 254, length 0
15:33:54.173526 IP (tos 0x0, ttl 128, id 7738, offset 0, flags [DF], proto TCP (6), length 40)
    192.168.1.115.60586 > 192.168.1.116.443: Flags [R.], cksum 0x363e (correct), seq 1085, ack 8889, win 0, length 0
15:33:54.174305 IP (tos 0x0, ttl 128, id 7739, offset 0, flags [DF], proto TCP (6), length 52)
    192.168.1.115.60589 > 192.168.1.116.443: Flags [S], cksum 0x7665 (correct), seq 2133067494, win 65535, options [mss 1460,nop,wscale 8,nop,nop,sackOK], length 0
15:33:54.174341 IP (tos 0x0, ttl 64, id 0, offset 0, flags [DF], proto TCP (6), length 52)
    192.168.1.116.443 > 192.168.1.115.60589: Flags [S.], cksum 0x845e (incorrect -> 0xf948), seq 1059376087, ack 2133067495, win 29200, options [mss 1460,nop,nop,sackOK,nop,wscale 7], length 0
15:33:54.174475 IP (tos 0x0, ttl 128, id 7740, offset 0, flags [DF], proto TCP (6), length 40)
    192.168.1.115.60589 > 192.168.1.116.443: Flags [.], cksum 0xa82b (correct), seq 1, ack 1, win 1024, length 0
15:33:54.174667 IP (tos 0x0, ttl 128, id 7741, offset 0, flags [DF], proto TCP (6), length 242)
    192.168.1.115.60589 > 192.168.1.116.443: Flags [P.], cksum 0x4a13 (correct), seq 1:203, ack 1, win 1024, length 202
15:33:54.174725 IP (tos 0x0, ttl 64, id 6034, offset 0, flags [DF], proto TCP (6), length 40)
    192.168.1.116.443 > 192.168.1.115.60589: Flags [.], cksum 0x8452 (incorrect -> 0xaa74), seq 1, ack 203, win 237, length 0
15:33:54.175842 IP (tos 0x0, ttl 64, id 6035, offset 0, flags [DF], proto TCP (6), length 196)
    192.168.1.116.443 > 192.168.1.115.60589: Flags [P.], cksum 0x84ee (incorrect -> 0xa417), seq 1:157, ack 203, win 237, length 156
15:33:54.176052 IP (tos 0x0, ttl 128, id 7742, offset 0, flags [DF], proto TCP (6), length 40)
    192.168.1.115.60589 > 192.168.1.116.443: Flags [.], cksum 0xa6c6 (correct), seq 203, ack 157, win 1023, length 0
15:33:54.176551 IP (tos 0x0, ttl 128, id 7743, offset 0, flags [DF], proto TCP (6), length 91)
    192.168.1.115.60589 > 192.168.1.116.443: Flags [P.], cksum 0x325d (correct), seq 203:254, ack 157, win 1023, length 51
15:33:54.177800 IP (tos 0x0, ttl 128, id 7744, offset 0, flags [DF], proto TCP (6), length 479)
    192.168.1.115.60589 > 192.168.1.116.443: Flags [P.], cksum 0x0e07 (correct), seq 254:693, ack 157, win 1023, length 439
15:33:54.177869 IP (tos 0x0, ttl 64, id 6036, offset 0, flags [DF], proto TCP (6), length 40)
    192.168.1.116.443 > 192.168.1.115.60589: Flags [.], cksum 0x8452 (incorrect -> 0xa7e6), seq 157, ack 693, win 245, length 0
15:33:54.433720 IP (tos 0x0, ttl 64, id 6037, offset 0, flags [DF], proto TCP (6), length 2858)
    192.168.1.116.443 > 192.168.1.115.60589: Flags [P.], cksum 0x8f54 (incorrect -> 0x08da), seq 157:2975, ack 693, win 245, length 2818
15:33:54.433910 IP (tos 0x0, ttl 128, id 7745, offset 0, flags [DF], proto TCP (6), length 40)
    192.168.1.115.60589 > 192.168.1.116.443: Flags [.], cksum 0x9f27 (correct), seq 693, ack 1617, win 1024, length 0
15:33:54.433929 IP (tos 0x0, ttl 128, id 7746, offset 0, flags [DF], proto TCP (6), length 40)
    192.168.1.115.60589 > 192.168.1.116.443: Flags [.], cksum 0x99df (correct), seq 693, ack 2975, win 1018, length 0
15:33:54.437955 IP (tos 0x0, ttl 128, id 7748, offset 0, flags [DF], proto TCP (6), length 52)
    192.168.1.115.60590 > 192.168.1.116.443: Flags [S], cksum 0x4e2b (correct), seq 155624701, win 65535, options [mss 1460,nop,wscale 8,nop,nop,sackOK], length 0
15:33:54.438005 IP (tos 0x0, ttl 64, id 0, offset 0, flags [DF], proto TCP (6), length 52)
    192.168.1.116.443 > 192.168.1.115.60590: Flags [S.], cksum 0x845e (incorrect -> 0x0bec), seq 2892178363, ack 155624702, win 29200, options [mss 1460,nop,nop,sackOK,nop,wscale 7], length 0
15:33:54.438034 IP (tos 0x0, ttl 128, id 7747, offset 0, flags [DF], proto TCP (6), length 52)
    192.168.1.115.60591 > 192.168.1.116.443: Flags [S], cksum 0xee45 (correct), seq 282000729, win 65535, options [mss 1460,nop,wscale 8,nop,nop,sackOK], length 0
15:33:54.438052 IP (tos 0x0, ttl 64, id 0, offset 0, flags [DF], proto TCP (6), length 52)
    192.168.1.116.443 > 192.168.1.115.60591: Flags [S.], cksum 0x845e (incorrect -> 0x3972), seq 4058468555, ack 282000730, win 29200, options [mss 1460,nop,nop,sackOK,nop,wscale 7], length 0
15:33:54.438066 IP (tos 0x0, ttl 128, id 7749, offset 0, flags [DF], proto TCP (6), length 52)
    192.168.1.115.60592 > 192.168.1.116.443: Flags [S], cksum 0x1650 (correct), seq 71295453, win 65535, options [mss 1460,nop,wscale 8,nop,nop,sackOK], length 0
15:33:54.438083 IP (tos 0x0, ttl 64, id 0, offset 0, flags [DF], proto TCP (6), length 52)
    192.168.1.116.443 > 192.168.1.115.60592: Flags [S.], cksum 0x845e (incorrect -> 0xd0cd), seq 141282038, ack 71295454, win 29200, options [mss 1460,nop,nop,sackOK,nop,wscale 7], length 0
15:33:54.438101 IP (tos 0x0, ttl 128, id 7750, offset 0, flags [DF], proto TCP (6), length 52)
    192.168.1.115.60593 > 192.168.1.116.443: Flags [S], cksum 0x7012 (correct), seq 599025829, win 65535, options [mss 1460,nop,wscale 8,nop,nop,sackOK], length 0
15:33:54.438118 IP (tos 0x0, ttl 64, id 0, offset 0, flags [DF], proto TCP (6), length 52)
    192.168.1.116.443 > 192.168.1.115.60593: Flags [S.], cksum 0x845e (incorrect -> 0x2e52), seq 1127713896, ack 599025830, win 29200, options [mss 1460,nop,nop,sackOK,nop,wscale 7], length 0
15:33:54.438134 IP (tos 0x0, ttl 128, id 7751, offset 0, flags [DF], proto TCP (6), length 40)
    192.168.1.115.60590 > 192.168.1.116.443: Flags [.], cksum 0xbace (correct), seq 1, ack 1, win 1024, length 0
15:33:54.438272 IP (tos 0x0, ttl 128, id 7752, offset 0, flags [DF], proto TCP (6), length 40)
    192.168.1.115.60591 > 192.168.1.116.443: Flags [.], cksum 0xe854 (correct), seq 1, ack 1, win 1024, length 0
15:33:54.438281 IP (tos 0x0, ttl 128, id 7753, offset 0, flags [DF], proto TCP (6), length 40)
    192.168.1.115.60592 > 192.168.1.116.443: Flags [.], cksum 0x7fb0 (correct), seq 1, ack 1, win 1024, length 0
15:33:54.438287 IP (tos 0x0, ttl 128, id 7754, offset 0, flags [DF], proto TCP (6), length 242)
    192.168.1.115.60590 > 192.168.1.116.443: Flags [P.], cksum 0x0180 (correct), seq 1:203, ack 1, win 1024, length 202
15:33:54.438316 IP (tos 0x0, ttl 64, id 65328, offset 0, flags [DF], proto TCP (6), length 40)
    192.168.1.116.443 > 192.168.1.115.60590: Flags [.], cksum 0x8452 (incorrect -> 0xbd17), seq 1, ack 203, win 237, length 0
15:33:54.438346 IP (tos 0x0, ttl 128, id 7755, offset 0, flags [DF], proto TCP (6), length 40)
    192.168.1.115.60593 > 192.168.1.116.443: Flags [.], cksum 0xdd34 (correct), seq 1, ack 1, win 1024, length 0
15:33:54.438353 IP (tos 0x0, ttl 128, id 7756, offset 0, flags [DF], proto TCP (6), length 242)
    192.168.1.115.60591 > 192.168.1.116.443: Flags [P.], cksum 0x0afd (correct), seq 1:203, ack 1, win 1024, length 202
15:33:54.438369 IP (tos 0x0, ttl 64, id 35904, offset 0, flags [DF], proto TCP (6), length 40)
    192.168.1.116.443 > 192.168.1.115.60591: Flags [.], cksum 0x8452 (incorrect -> 0xea9d), seq 1, ack 203, win 237, length 0
15:33:54.438389 IP (tos 0x0, ttl 128, id 7757, offset 0, flags [DF], proto TCP (6), length 242)
    192.168.1.115.60592 > 192.168.1.116.443: Flags [P.], cksum 0x6e0b (correct), seq 1:203, ack 1, win 1024, length 202
15:33:54.438406 IP (tos 0x0, ttl 64, id 5755, offset 0, flags [DF], proto TCP (6), length 40)
    192.168.1.116.443 > 192.168.1.115.60592: Flags [.], cksum 0x8452 (incorrect -> 0x81f9), seq 1, ack 203, win 237, length 0
15:33:54.438433 IP (tos 0x0, ttl 128, id 7758, offset 0, flags [DF], proto TCP (6), length 242)
    192.168.1.115.60593 > 192.168.1.116.443: Flags [P.], cksum 0x0e57 (correct), seq 1:203, ack 1, win 1024, length 202
15:33:54.438457 IP (tos 0x0, ttl 64, id 20709, offset 0, flags [DF], proto TCP (6), length 40)
    192.168.1.116.443 > 192.168.1.115.60593: Flags [.], cksum 0x8452 (incorrect -> 0xdf7d), seq 1, ack 203, win 237, length 0
15:33:54.439434 IP (tos 0x0, ttl 64, id 65329, offset 0, flags [DF], proto TCP (6), length 196)
    192.168.1.116.443 > 192.168.1.115.60590: Flags [P.], cksum 0x84ee (incorrect -> 0x61f1), seq 1:157, ack 203, win 237, length 156
15:33:54.439870 IP (tos 0x0, ttl 128, id 7759, offset 0, flags [DF], proto TCP (6), length 40)
    192.168.1.115.60590 > 192.168.1.116.443: Flags [.], cksum 0xb969 (correct), seq 203, ack 157, win 1023, length 0
15:33:54.439883 IP (tos 0x0, ttl 128, id 7760, offset 0, flags [DF], proto TCP (6), length 91)
    192.168.1.115.60590 > 192.168.1.116.443: Flags [P.], cksum 0xeedc (correct), seq 203:254, ack 157, win 1023, length 51
15:33:54.440091 IP (tos 0x0, ttl 64, id 35905, offset 0, flags [DF], proto TCP (6), length 196)
    192.168.1.116.443 > 192.168.1.115.60591: Flags [P.], cksum 0x84ee (incorrect -> 0x17ff), seq 1:157, ack 203, win 237, length 156
15:33:54.440211 IP (tos 0x0, ttl 128, id 7761, offset 0, flags [DF], proto TCP (6), length 40)
    192.168.1.115.60591 > 192.168.1.116.443: Flags [.], cksum 0xe6ef (correct), seq 203, ack 157, win 1023, length 0
15:33:54.440435 IP (tos 0x0, ttl 128, id 7762, offset 0, flags [DF], proto TCP (6), length 91)
    192.168.1.115.60591 > 192.168.1.116.443: Flags [P.], cksum 0x10ef (correct), seq 203:254, ack 157, win 1023, length 51
15:33:54.440521 IP (tos 0x0, ttl 128, id 7763, offset 0, flags [DF], proto TCP (6), length 533)
